sample_id,reference_raw,reference_norm,hypothesis_A_original,wer_A_original,latency_mean_A_original,latency_std_A_original,hypothesis_B_pt_pinned,wer_B_pt_pinned,latency_mean_B_pt_pinned,latency_std_B_pt_pinned,peak_vram_mb,quantized
pt-PT~BUSINESS_LOAN/response_28.wav,Olá bom dia estou a ligar que tenho uma pergunta sobre o empréstimo comercial Novo que gostava de fazer por favor,olá bom dia estou a ligar que tenho uma pergunta sobre o empréstimo comercial novo que gostava de fazer por favor,"Hello, good day. I'm calling because I have a question about a commercial loan that I would like to do, please.",1.0,1.2829879436664366,0.004620173524171196,"Hala, bon dia. Eu estou a ligar porque tenho uma pergunta sobre um empréstimo comercial novo que gostava de fazer, por favor.",0.23809523809523808,1.7013628836666612,0.013303326260385802,6010.40869140625,False
pt-PT~CASH_DEPOSIT/response_11.wav,depositar dinheiro,depositar dinheiro,盖着玻璃盖的门,1.0,0.4120984699999705,0.004478665414571682,盖子可以打开吗？,1.0,0.40318044333344005,0.002140616164328723,6010.40869140625,False
pt-PT~BUSINESS_LOAN/response_11.wav,Boa tarde Queria contratar um novo empréstimo o granny a dar informações,boa tarde queria contratar um novo empréstimo o granny a dar informações,"Boa tarde, queria contratar um novo empréstimo, poder-meia dar informações?",0.25,1.071470558999863,0.003606580082892287,"Boa tarde, queria contratar um novo empréstimo, poder-me a dar informações?",0.16666666666666666,1.0737560719996206,0.0007095089725697722,6010.40869140625,False
pt-PT~ADDRESS/response_25.wav,gostava de mudar o meu endereço,gostava de mudar o meu endereço,我正在改变我的地址,1.0,0.37718444866610906,0.003122621332608083,保底，我正在搬家。,1.0,0.4731186960001044,0.009898522795734716,6010.40869140625,False
pt-PT~CARD_ISSUES/CA4386f41ca6bc639969b8110d4dd6704e_0.wav,Olá estou a tentar utilizar o meu cartão de crédito mas estou a ter dificuldades o pagamento foi recusado e sei que não há qualquer problema a nível do saldo existente Será que me conseguem ajudar a perceber qual é o problema obrigada,olá estou a tentar utilizar o meu cartão de crédito mas estou a ter dificuldades o pagamento foi recusado e sei que não há qualquer problema a nível do saldo existente será que me conseguem ajudar a perceber qual é o problema obrigada,"Hello, I'm trying to use my credit card but I'm having difficulties because the payment was rejected. This is that there's no problem at the level of the existing balance. Will you be able to help me understand what is the problem? Thank you.",1.0232558139534884,2.4337144090001552,0.014496626075550589,"Hola, estoy intentando utilizar o meu cartão de crédito mas estou a ter dificuldades. O pagamento foi recusado e sei que não há qualquer problema a nível do saldo existente. Será que me conseguem ajudar a proceder qual é o problema? Obrigada.",0.11627906976744186,2.850062818666629,0.013218388760935845,6010.40869140625,False
pt-PT~ABROAD/CAe51c9ca4d2e65b98f00b372a480f8867_2.wav,eu preciso do meu cartão no exteriores é possível apagar aquilo que tenho na América,eu preciso do meu cartão no exteriores é possível apagar aquilo que tenho na américa,Eu preciso do meu cartão no exterior. É possível pagar o que eu tenho na América?,0.26666666666666666,1.083113193666577,0.0023902049039750575,Eu preciso do meu cartão no exterior. É possível pagar o que eu tenho na América?,0.26666666666666666,1.0825032396666454,0.003794344143657423,6010.40869140625,False
pt-PT~ADDRESS/response_11.wav,eu gostaria de mudar meu endereço derivado a foto tem um bocado Como posso parecer,eu gostaria de mudar meu endereço derivado a foto tem um bocado como posso parecer,"I would like to move my address, due to the fact of having moved house, and I would like to proceed with a table test.",1.6666666666666667,1.3825188509999862,0.007941988542968492,"Eu gostaria de mudar o meu endereço, devido ao facto de ter mudado de casa.",0.6666666666666666,1.111874013333363,0.005262023819138232,6010.40869140625,False
pt-PT~APP_ERROR/response_30.wav,o aplicativo não carrega,o aplicativo não carrega,O aplicativo não carrega.,0.0,0.45575604366634553,0.0015558169834083563,O aplicativo não carrega.,0.0,0.4566557923332463,0.004542222257739026,6010.40869140625,False
pt-PT~HIGH_VALUE_PAYMENT/response_24.wav,Bom dia Estou a tentar fazer um grande pagamento online e Supostamente tem que ser uma mensagem de texto mas não sei o que é que é suposto fazer com ela pode me explicar,bom dia estou a tentar fazer um grande pagamento online e supostamente tem que ser uma mensagem de texto mas não sei o que é que é suposto fazer com ela pode me explicar,"Um dia, estou a fazer um grande pagamento online e supostamente tenho recebido uma mensagem de texto, mas não sei o que é que é suposto fazer com ela. Pode-me explicar?",0.20588235294117646,2.1407981530001052,0.003044131221337963,"Um dia, estou a fazer um grande pagamento online e supostamente tenho recebido uma mensagem de texto, mas não sei o que é que é suposto fazer com ela. Pode-me explicar?",0.20588235294117646,2.1382634829997187,0.010329677850206808,6010.40869140625,False
pt-PT~CASH_DEPOSIT/response_15.wav,hello I'm calling you Out To deposit money in my Bag House,hello im calling you out to deposit money in my bag house,"Hello, I'm calling because I don't know how to deposit money in my bank account. Can you help me please?",1.0,1.252498070333786,0.009566992381148972,"Hello, I'm calling because I don't know how to deposit money in my bank account. Can you help me please?",1.0,1.2579610559996581,0.007664171819844543,6010.40869140625,False
pt-PT~ABROAD/CA269e63f4381658ad0dcf33014906ca7a_3.wav,vou viajar para América e não sei se consigo pagar com o meu Cartão bancário,vou viajar para américa e não sei se consigo pagar com o meu cartão bancário,Vou viajar para a América e não sei se consigo pagar com o meu cartão bancário.,0.06666666666666667,1.12903516799967,0.0032530013474957415,Vou viajar para a América e não sei se consigo pagar com o meu cartão bancário.,0.06666666666666667,1.1136676913335275,0.00794254063997476,6010.40869140625,False
pt-PT~APP_ERROR/response_1.wav,eu não consigo abrir a aplicação ela está sempre a encravar,eu não consigo abrir a aplicação ela está sempre a encravar,我不能打开应用程序，它总是被卡住。,1.0,0.6392394460002228,0.004046368189407275,"Eu não consigo abrir a aplicação, ela está sempre encravando.",0.18181818181818182,0.8963795186670419,0.006416214515554753,6010.40869140625,False
pt-PT~HIGH_VALUE_PAYMENT/response_36.wav,não sei o que fazer com os códigos SMS confirmação que estou a receber,não sei o que fazer com os códigos sms confirmação que estou a receber,Não sei o que fazer com os códigos SMS de confirmação que estou a receber.,0.07142857142857142,1.073099227332932,0.005182270740019863,Não sei o que fazer com os códigos SMS de confirmação que estou a receber.,0.07142857142857142,1.0767669473331505,0.0012775875884913875,6010.40869140625,False
pt-PT~CARD_ISSUES/response_8.wav,Boa tarde Estava a tentar fazer um pagamento entretanto o meu pagamento foi recusado acredito que o meu cartão não está a funcionar E eu não acho que tenho que pagar por um novo,boa tarde estava a tentar fazer um pagamento entretanto o meu pagamento foi recusado acredito que o meu cartão não está a funcionar e eu não acho que tenho que pagar por um novo,"Good afternoon. I was trying to make a payment, and in the meantime my payment was refused. I believe that my card is not working, and I don't think I have to pay for a new one.",1.088235294117647,2.037838977666676,0.005887023526004223,"Boa tarde, eu estava tentando fazer um pagamento e, em contrário, o meu pagamento foi recusado. Acredito que o meu, o cartão não está funcionando e eu não acho que tenha que pagar por um novo.",0.29411764705882354,2.483803375666563,0.016419566204934625,6010.40869140625,False
pt-PT~ATM_LIMIT/response_2.wav,Qual é a quantidade máxima de dinheiro que posso tirar da caixa e complementar o meu limite,qual é a quantidade máxima de dinheiro que posso tirar da caixa e complementar o meu limite,"Qual é a quantidade máxima de dinheiro que eu posso tirar? O limite da caixa, e posso aumentar o meu limite?",0.29411764705882354,1.4346340870000251,0.018842568997085418,Qual é a quantidade máxima de dinheiro que eu posso tirar? O limite da caixa e posso aumentar o meu limite?,0.29411764705882354,1.392697345333545,0.003014469275792013,6010.40869140625,False
pt-PT~JOINT_ACCOUNT/CA02f8a7cadbb61efaccfcc0e3cf04648e_0.wav,Olá bom dia estava a tentar configurar uma conta conjunta com o meu parceiro só que eu não consigo encontrar essa opção no aplicativo podemos usar por favor,olá bom dia estava a tentar configurar uma conta conjunta com o meu parceiro só que eu não consigo encontrar essa opção no aplicativo podemos usar por favor,"Hello, good day. I was trying to configure a joint account with my partner, so that I can't find this option in the application. Could you help me, please?",1.0357142857142858,1.7528853103337194,0.00647882956035275,"Qualquer coisa. Olá, bom dia. Eu estava tentando configurar uma conta conjunta com o meu parceiro, só que eu não consigo encontrar essa opção no aplicativo. Poderia me ajudar, por favor?",0.2857142857142857,2.3661665090000192,0.007475686074358852,6010.40869140625,False
pt-PT~ADDRESS/response_27.wav,Gostava de dar um endereço,gostava de dar um endereço,我比较喜欢读小说,1.0,0.3606552783330699,0.00020031387674044292,Eu gostava de mudar um endereço.,0.4,0.5779371213332828,0.0016890782530163077,6010.40869140625,False
pt-PT~CASH_DEPOSIT/CAbb63e289bb0675503debcf0677b3021f_0.wav,Gostaria de saber como é que posso transferir dinheiro para a minha conta,gostaria de saber como é que posso transferir dinheiro para a minha conta,I would like to know how I can transfer money to my account.,1.0,0.7615599166668593,0.0009980225316718635,I would like to know how I can transfer money to my account.,1.0,0.77721299733336,0.007045661271396512,6010.40869140625,False
pt-PT~LATEST_TRANSACTIONS/CA94add4ef1067dca2587cba154fd4a827_2.wav,Eu gostava de saber qual é as minhas transações Como é que eu posso Verificar as minhas transações nos últimos meses não consigo consultar ultimamente eu gostava de saber como consultar,eu gostava de saber qual é as minhas transações como é que eu posso verificar as minhas transações nos últimos meses não consigo consultar ultimamente eu gostava de saber como consultar,I would like to know how I can verify my transactions in the last months. I cannot consult lately. I would like to know how I can consult.,1.0,1.5220914049999312,0.010680276195977922,"Eu gostava de saber qual é as minhas transações, como é que eu posso verificar as minhas transações nos últimos meses. Não consigo consultar ultimamente. Eu gostava de saber como as consultar.",0.03225806451612903,2.182272396000068,0.004807253818572875,6010.40869140625,False
pt-PT~HIGH_VALUE_PAYMENT/response_29.wav,estou aqui está a fazer um pagamento com uma quantia bastante grande mas todos uma mensagem de texto e eu não sei o que é suposto fazer com o código de envio pode me ajudar se faz favor,estou aqui está a fazer um pagamento com uma quantia bastante grande mas todos uma mensagem de texto e eu não sei o que é suposto fazer com o código de envio pode me ajudar se faz favor,"Estou aqui tentando fazer um pagamento com uma quantia bastante grande, mas estou recebendo uma mensagem de texto e eu não sei o que é que é suposto fazer com o código que me enviou. Pode me ajudar se for possível?",0.2894736842105263,2.535443286666729,0.028559994804246664,"Estou aqui tentando fazer um pagamento com uma quantia bastante grande, mas estou recebendo uma mensagem de texto e eu não sei o que é que é suposto fazer com o código que me enviou. Pode me ajudar se for possível?",0.2894736842105263,2.5656483023334054,0.023036814551662236,6010.40869140625,False
pt-PT~ABROAD/CA48cd2b1c9245b1e16b66800c03245806_3.wav,dá para usar o meu cartão do banco se eu estiver no outro país ou se tiver de férias durante alguns dias com a minha família ou tenho que ter algum outro procedimento,dá para usar o meu cartão do banco se eu estiver no outro país ou se tiver de férias durante alguns dias com a minha família ou tenho que ter algum outro procedimento,Dá para usar o meu cartão do banco se eu estiver no outro país ou se tivesse de férias durante alguns dias com minha família? Ou tenho que ter algum outro procedimento?,0.06060606060606061,2.04001622099986,0.008256583040715706,"Dá para usar o meu cartão do banco se eu estiver no outro país ou se tivesse de férias durante alguns dias com minha família, ou tenho que ter algum outro procedimento?",0.06060606060606061,2.052578554666676,0.005662305128676921,6010.40869140625,False
pt-PT~LATEST_TRANSACTIONS/CA7654d7470f3603d1e580f23852632397_0.wav,Olá gostaria de saber as minhas transações recentes,olá gostaria de saber as minhas transações recentes,"Hala, gosto de saber as minhas transacções recentes.",0.375,0.8545970426663795,0.01032653473548583,"Alô, gostaria de saber as minhas transações recentes.",0.125,0.8049218183332414,0.0016754981754821942,6010.40869140625,False
pt-PT~ABROAD/CA9b2964d73a9784ca4b03d6c0ce0ef47a_2.wav,eu gostaria de saber se o meu cartão do banco também funciona no exterior por exemplo posso pagar coisas quando se toma na América Estou sim,eu gostaria de saber se o meu cartão do banco também funciona no exterior por exemplo posso pagar coisas quando se toma na américa estou sim,"I would like to know if my bank card also works outside, for example, I can pay things when I'm in the United States. Is this so?",1.0384615384615385,1.6742406190002537,0.005768706656125082,"Eu gostaria de saber se o meu cartão do banco também funciona no exterior. Por exemplo, posso pagar coisas quando estou na América. Estou assim.",0.11538461538461539,1.8036349626666681,0.017586765300032,6010.40869140625,False
pt-PT~PAY_BILL/response_11.wav,Desejo fazer um pagamento,desejo fazer um pagamento,Vou fazer um pagamento,0.25,0.3648174630000843,0.002116028989362193,Vou fazer um pagamento,0.25,0.3631009000000631,0.0025808564715446656,6010.40869140625,False
pt-PT~FREEZE/response_34.wav,parar todas as transferências do meu cartão,parar todas as transferências do meu cartão,Parar todas as transferências do meu cartão.,0.0,0.6340716853334621,0.0035194021164485917,Parar todas as transferências do meu cartão.,0.0,0.637035672000214,0.0027952445019477456,6010.40869140625,False
pt-PT~ABROAD/CA27c7b9131e415a6ba8429cdee85efb07_1.wav,Boa tarde Eu preciso de usar o meu cartão no exterior e queria saber se por exemplo pode pagar as coisas quando estou na América,boa tarde eu preciso de usar o meu cartão no exterior e queria saber se por exemplo pode pagar as coisas quando estou na américa,"Good morning. I need to use my card in the exterior and I wanted to know if, for example, I can pay things when I am in America.",1.08,1.5804689863331685,0.007684296046299798,"Boa tarde, eu preciso de usar o meu cartão no exterior e quero saber se, por exemplo, posso pagar as coisas quando estou na América.",0.08,1.7327924256663512,0.004828702063457417,6010.40869140625,False
pt-PT~ABROAD/CA629fce6854cc925ccc6f29fe8ad2a2d4_2.wav,o meu cartão não funciona no estrangeiro,o meu cartão não funciona no estrangeiro,O meu cartão não funciona no estrangeiro.,0.0,0.6344056016666096,0.004507646051079189,O meu cartão não funciona no estrangeiro.,0.0,0.6377263026667302,0.005872603181068043,6010.40869140625,False
pt-PT~BALANCE/response_23.wav,Olá eu gostaria de saber qual é que é o saldo atual da minha conta Por favor,olá eu gostaria de saber qual é que é o saldo atual da minha conta por favor,"Hala, eu gostaria de saber qual é o saldo atual da minha conta, por favor.",0.17647058823529413,1.1123352106666669,0.0074132500602617606,"Alá, eu gostaria de saber qual é o saldo atual da minha conta, por favor.",0.17647058823529413,1.0751306200002848,0.0004888288598212578,6010.40869140625,False
pt-PT~ABROAD/CA76341380336fd6d09bcc42e36e45fc4d_5.wav,preciso de utilizar o meu cartão no estrangeiro,preciso de utilizar o meu cartão no estrangeiro,呃，我需要使用我的卡在外国。,1.0,0.6049483823335322,0.005699212300679165,呃，我需要使用我的卡在外国。,1.0,0.5949456810000507,0.0008255048556986358,6010.40869140625,False
pt-PT~ABROAD/CAbec16c2f8cf240d0de01ffaba3c6f7b9_2.wav,Olá boa tarde é assim eu tenho um cartão do banco do banco e eu gostava de saber se for viajar por exemplo se posso usar o meu cartão se por exemplo posso usar o meu cartão no outro país porque eu estou a pensar viajar para América e já saber se posso pagar usando vosso cartão na América eu vou fazer umas férias e e gostava de saber se tem que fazer alguma coisa para usar o cartão lá fora,olá boa tarde é assim eu tenho um cartão do banco do banco e eu gostava de saber se for viajar por exemplo se posso usar o meu cartão se por exemplo posso usar o meu cartão no outro país porque eu estou a pensar viajar para américa e já saber se posso pagar usando vosso cartão na américa eu vou fazer umas férias e e gostava de saber se tem que fazer alguma coisa para usar o cartão lá fora,"Hello, good afternoon. It's like I have a card from the bank, from your bank. I would like to know if I'm going to travel, for example, if I can use my card, if, for example, if I can use my card in another country because I am thinking of traveling to America and I would like to know if I can pay using your card in America. I will be doing some holidays and I would like to know if I have to do something to use the card outside.",1.1111111111111112,4.898714223999984,0.05235916006052852,"Olá, boa tarde. É assim, eu tenho um cartão do banco, do vosso banco, e eu gostava de saber se, se eu for viajar, por exemplo, se posso usar o meu cartão, se, por exemplo, se posso usar o meu cartão no outro país porque eu estou a pensar viajar para a América e gostava de saber se posso pagar usando o vosso cartão na América. Eu vou fazer algumas férias e e gostava de saber se tem que fazer alguma coisa para usar o cartão lá fora.",0.1111111111111111,5.684801257333372,0.048186885508280056,6010.40869140625,False
pt-PT~APP_ERROR/response_8.wav,Boa tarde eu gostaria de ter o meu aplicativo não carrega não consigo queria ser contactado por esse mesmo endereço al,boa tarde eu gostaria de ter o meu aplicativo não carrega não consigo queria ser contactado por esse mesmo endereço al,"Um, good afternoon. I would like to communicate a problem that I have with my application. It does not archive and I cannot access the album. Could it be contacted by this same address or by email?",1.7619047619047619,1.9992742579997866,0.0038823570954610786,"Boa tarde, eu gostaria de comunicar um problema que estou tendo com o meu aplicativo. Não carreguei, não consigo verificar o salvo. Poderia ser contactado por este mesmo endereço ou por e-mail?",0.7619047619047619,2.520861715666797,0.03664442904723919,6010.40869140625,False
pt-PT~CASH_DEPOSIT/response_20.wav,Como faço para transferir o dinheiro para conta,como faço para transferir o dinheiro para conta,Como faço para transferir o dinheiro para conta,0.0,0.5928304569997636,0.00879868798209594,Como faço pra transferir o dinheiro pra conta,0.25,0.5965083653327383,0.004777950153875248,6010.40869140625,False
pt-PT~ABROAD/CA1f8647d95bd51c9a59389220c42e2388_3.wav,Olá sim boa tarde eu tenho um cartão de crédito neste banco e gostava de saber se este cartão funciona se ele for a qualquer outro país só que funciona Estando na União Europeia e no resto do mundo sem ser da União Europeia,olá sim boa tarde eu tenho um cartão de crédito neste banco e gostava de saber se este cartão funciona se ele for a qualquer outro país só que funciona estando na união europeia e no resto do mundo sem ser da união europeia,"Hello, yes, good afternoon. I have a credit card at this bank and I would like to know if this card works in any other country. Will it work staying in the European Union and in the rest of the world, except in the European Union?",1.0454545454545454,2.4914176323330444,0.024458583781201595,"Ah, hello, sim, boa tarde. Ah, eu tenho um cartão de crédito neste banco e gostava de saber se este cartão funciona se eu for a qualquer outro país. Ah, se o cartão funciona sendo na União Europeia e no resto do mundo, desde que seja na União Europeia.",0.29545454545454547,3.1049751596668407,0.009466762595655674,6010.40869140625,False
pt-PT~ADDRESS/CA1ad19360087b8a4af9b513c613fa119d_0.wav,Olá eu gostaria de mudar o meu endereço queria que está aqui é possível,olá eu gostaria de mudar o meu endereço queria que está aqui é possível,"Hello, I would like to change my address. Is it possible?",1.0,0.7852293749995928,0.004907572479710929,"Fala, eu gostaria de mudar o meu endereço, seria possível?",0.42857142857142855,0.8982856773333575,0.004158837040423996,6010.40869140625,False
pt-PT~BUSINESS_LOAN/response_15.wav,Até eu queria saber mais coisas sobre os empréstimos eu posso fazer,até eu queria saber mais coisas sobre os empréstimos eu posso fazer,"I say to you, I really want to know more about the investment that I can do on the investment.",1.6666666666666667,1.1141220910000509,0.012798061129846532,"Cuidado, eu quero saber mais coisas sobre os empregados que eu posso fazer sobre o pessoal em.",0.6666666666666666,1.3205629733335325,0.002718411618091949,6010.40869140625,False
pt-PT~ADDRESS/response_12.wav,Eu quero alterar o endereço,eu quero alterar o endereço,Eu quero alterar meu endereço.,0.2,0.5449039243333876,0.001708156271660296,Eu quero alterar meu endereço.,0.2,0.547624670333183,0.00290733844680952,6010.40869140625,False
pt-PT~ATM_LIMIT/response_26.wav,Qual é o máximo dinheiro posso tirar,qual é o máximo dinheiro posso tirar,Qualo mafin yar poz qiraz?,1.0,0.7115755230000408,0.00124838080783423,Qual umas em dinheiro posso tirar?,0.42857142857142855,0.587492806666584,0.010908853421178146,6010.40869140625,False
pt-PT~ABROAD/CA68cab9cfb046a6973a816a7c6ce2d74e_0.wav,Olá eu tenho um cartão vosso e quero usá-lo nos Estados Unidos da América já que eu posso usar lá para fazer as minhas compras porque eu vou sair de férias e queria saber se tenho que fazer alguma coisa antes de ir obrigada,olá eu tenho um cartão vosso e quero usálo nos estados unidos da américa já que eu posso usar lá para fazer as minhas compras porque eu vou sair de férias e queria saber se tenho que fazer alguma coisa antes de ir obrigada,"Hello, I have a card VISA and I want to use it in the United States of America. Will I be able to use it there for making my purchases because I'm going to go on a series and I wanted to know if I need to do anything before going. Thank you.",1.2045454545454546,2.819028853667078,0.012965557721023271,"Qualquer outro serviço? Olá, eu tenho um cartão VISA e quero usá-lo nos Estados Unidos da América. Será que eu posso usá-lo lá para fazer as minhas compras? Porque eu vou sair de férias e queria saber se tenho que fazer alguma coisa antes de ir. Obrigada.",0.13636363636363635,3.582477680000011,0.015225314408839454,6010.40869140625,False
pt-PT~DIRECT_DEBIT/response_42.wav,Bom dia Olha eu queria aceder aos débitos diretos da minha conta Está a haver um problema Eu acho que tu me estão a tirar dinheiro indevidamente,bom dia olha eu queria aceder aos débitos diretos da minha conta está a haver um problema eu acho que tu me estão a tirar dinheiro indevidamente,Good day. I would like to access the debits direct from my account. Is there a problem? I think that we are taking money individually.,1.0,1.4891267996666404,0.01063546357380663,"Bom dia. Olha, eu queria acessar os débitos diretos da minha conta. Tá a vir um problema? Eu acho que como estão a tirar o dinheiro individualmente.",0.2962962962962963,2.125484779333116,0.007294915370497665,6010.40869140625,False
pt-PT~DIRECT_DEBIT/response_10.wav,almoço sobre débitos diretos,almoço sobre débitos diretos,Um sobre débitos direitos.,0.5,0.5106707753329829,0.005761462557658406,Qual sobre débitos direitos.,0.5,0.5086052406665355,0.0022670933759590408,6010.40869140625,False
pt-PT~CARD_ISSUES/response_32.wav,estou conseguindo usar o meu cartão não funciona não permite pagar porque o meu pagamento foi recusado a que meter em papel,estou conseguindo usar o meu cartão não funciona não permite pagar porque o meu pagamento foi recusado a que meter em papel,"I'm still able to use my card because it doesn't work, it doesn't allow me to pay. Why did my payment get rejected? Will you please help me? Thank you.",1.3636363636363635,1.8392074560000158,0.024855285185348103,"Mas sou capaz de usar o meu cartão porque não funciona, não me permite pagar. Por isso, o meu pagamento foi recusado. Será que poderiam ajudar? Obrigado.",0.5454545454545454,1.9996946196664187,0.004823877151707762,6010.40869140625,False
