sample_id,reference_raw,reference_norm,hypothesis_A_original,wer_A_original,latency_mean_A_original,latency_std_A_original,hypothesis_B_pt_pinned,wer_B_pt_pinned,latency_mean_B_pt_pinned,latency_std_B_pt_pinned,peak_vram_mb,quantized
pt-PT~CASH_DEPOSIT/CA59aeb34ba21bacedbfd65622d938f401_0.wav,posso depositar o dinheiro como é que eu faço para transferir o dinheiro para a conta Em que sítio é que eu posso depositar o dinheiro podia ajudar me,posso depositar o dinheiro como é que eu faço para transferir o dinheiro para a conta em que sítio é que eu posso depositar o dinheiro podia ajudar me,Posso depositar o dinheiro? Como é que eu faço para transferir o dinheiro para a conta? Em que sítio é que eu posso depositar o dinheiro? Poderia ajudar-me?,0.10344827586206896,2.1003777666668006,0.012417510698888133,Posso depositar o dinheiro? Como é que eu faço para transferir o dinheiro para a conta? Em que sítio é que eu posso depositar o dinheiro? Poderia ajudar-me?,0.10344827586206896,2.138202068999817,0.023958415038435547,6010.40869140625,False
pt-PT~BUSINESS_LOAN/response_12.wav,Um dia tu ligar por causa de um empréstimo comercial tem umas dúvidas sobre as condições do vosso empréstimo,um dia tu ligar por causa de um empréstimo comercial tem umas dúvidas sobre as condições do vosso empréstimo,"Um dia, to ligado por causa de um empréstimo comercial. Tenho algumas dúvidas sobre as condições do vosso empréstimo.",0.21052631578947367,1.6087518049998835,0.005005102331454938,"Um dia, to ligado por causa de um empréstimo comercial. Tenho algumas dúvidas sobre as condições do vosso empréstimo.",0.21052631578947367,1.6484217316665308,0.027481183143724153,6010.40869140625,False
pt-PT~APP_ERROR/CAf4d4b70c88496e0077d3044bc2019705_0.wav,aplicativo não carrega,aplicativo não carrega,Oplicativo non carrega.,0.6666666666666666,0.4627845530000438,0.004927779869062005,O aplicativo não carrega.,0.3333333333333333,0.45683806733359233,0.0008527836544685491,6010.40869140625,False
pt-PT~APP_ERROR/response_14.wav,Bom dia o aplicativo do banco não está a funcionar,bom dia o aplicativo do banco não está a funcionar,"Bom dia, o aplicativo do Bando não está a funcionar. Tá esperando-me dizer o salvo mas não avança.",0.9,1.5268419803336049,0.011515347645597319,"Bom dia. O aplicativo do banco não está a funcionar. Tá esperando que me diga o saldo, mas não avança.",1.0,1.5387554376669261,0.02099248179332954,6010.40869140625,False
pt-PT~PAY_BILL/response_20.wav,Alguém tem que pagar uma conta e essa pessoa quer fazer um pagamento no entanto a fatura diz que o meu cartão está vencido,alguém tem que pagar uma conta e essa pessoa quer fazer um pagamento no entanto a fatura diz que o meu cartão está vencido,"Alguém tem que pagar a minha conta e essa pessoa quer fazer um pagamento, no entanto, a fatura diz que o meu cartão está vencido.",0.08333333333333333,1.7075379326667341,0.010629136739334917,"Alguém tem que pagar uma conta e essa pessoa quer fazer um pagamento. No entanto, a fatura diz que o meu cartão está vencido.",0.0,1.6629278400005205,0.009559904282595354,6010.40869140625,False
pt-PT~HIGH_VALUE_PAYMENT/CA08d134ed2c9a5a8682adce9b8c4abd0c_0.wav,pagamento de caro Estou tentando fazer uma grande pagamento online e diz que estou recebendo a mensagem de texto Não sei o que essas mensagens sms com os códigos pagamento que percebe que devem fazer,pagamento de caro estou tentando fazer uma grande pagamento online e diz que estou recebendo a mensagem de texto não sei o que essas mensagens sms com os códigos pagamento que percebe que devem fazer,"Pagamento de carro. Tudo em torno de fazer uma grande pagamento online e diz que estou recebendo mensagem de texto. Não sei o que essas mensagens, esses emails respondem que o pagamento que eu recebo, o que devem fazer.",0.4,2.7335033943336384,0.02338584662742831,"Pagamento de cartão. Tudo num tamanho fazer uma grande pagamento online e diz que estou recebendo mensagem de texto. Não sei o que essas mensagens, esses emails respondem que o pagamento que eu recebo, o que devem fazer.",0.37142857142857144,2.779374579000129,0.01580555075037244,6010.40869140625,False
pt-PT~ABROAD/CA80007bca82031e83ee00317488b989ee_2.wav,eu preciso do meu cartão para usar no outro país que posso pagar o meu cartão com o meu cartão quando estou na América porque eu vou passar algum passar férias algumas semanas e queria perguntar tenho que fazer alguma coisa,eu preciso do meu cartão para usar no outro país que posso pagar o meu cartão com o meu cartão quando estou na américa porque eu vou passar algum passar férias algumas semanas e queria perguntar tenho que fazer alguma coisa,"Eu preciso do meu cartão para usar no outro país. Eu posso pagar o meu cartão quando estou com o meu cartão quando estou na América, porque eu vou passar alguma, vou passar lá férias algumas semanas e quero perguntar se tem que fazer alguma coisa.",0.21951219512195122,3.087864087333704,0.003411318957592906,"Eu preciso do meu cartão para usar no outro país. Eu posso pagar o meu cartão quando estou com o meu cartão quando estou na América, porque eu vou passar alguma. Eu vou passar lá férias algumas semanas e quero perguntar se tenho que fazer alguma coisa.",0.21951219512195122,3.1769692566670833,0.03186887918779323,6010.40869140625,False
pt-PT~CASH_DEPOSIT/CAcf6959dec016c0b565930f88c98e4f21_0.wav,Onde posso depositar meu dinheiro,onde posso depositar meu dinheiro,Onde posso depositar o meu dinheiro?,0.2,0.5887109409998933,0.00370930073313276,Onde posso depositar o meu dinheiro?,0.2,0.6060957623337041,0.001795118858340231,6010.40869140625,False
pt-PT~FREEZE/CA769a384d5affb5582a34622d60f40f15_0.wav,Boa tarde eu tenho um cartão associado com a vossa empresa e pretendo deixar do deslizar seja congelar esse mesmo cartão por favor se se conseguir mais rápido possível Desativar se e bloquear esse mesmo cartão,boa tarde eu tenho um cartão associado com a vossa empresa e pretendo deixar do deslizar seja congelar esse mesmo cartão por favor se se conseguir mais rápido possível desativar se e bloquear esse mesmo cartão,"Boa tarde, eu tenho um cartão associado com a sua empresa e pretendo deixar de usar, seja congelar esse mesmo cartão. Por favor, se conseguir o mais rápido possível desativar e bloquear esse mesmo cartão.",0.16666666666666666,2.5319916983335133,0.023156294507837696,"Boa tarde, eu tenho um cartão associado com a sua empresa e pretendo deixar de usar, ou seja, congelar esse mesmo cartão. Por favor, se conseguir o mais rápido possível desativar e bloquear esse mesmo cartão.",0.19444444444444445,2.598484785333312,0.01461991912930436,6010.40869140625,False
pt-PT~CASH_DEPOSIT/response_12.wav,como acha que deve tomar para transferir dinheiro da minha conta,como acha que deve tomar para transferir dinheiro da minha conta,怎么，卡号是几号，怎么转钱到我的卡上？,1.0,0.8576090923331018,0.015277316778359222,呃，怎么？嗯，这个卡是卡的吗？,1.0,0.7223607826666315,0.0014147292929925911,6010.40869140625,False
pt-PT~APP_ERROR/CA8c1137dbc0ee3f27731206191c2ca31a_0.wav,aplicação não está a carregar,aplicação não está a carregar,应用程序没有加载,1.0,0.27936351666661113,0.0005238203431417178,A aplicação não está a carregar,0.2,0.5010840353331029,0.001196500798619952,6010.40869140625,False
pt-PT~ABROAD/CA4fde63e3e6be360bd887dfd727b385d3_5.wav,cartão no exterior quando tiver na América do Norte posso pagar as minhas coisas,cartão no exterior quando tiver na américa do norte posso pagar as minhas coisas,卡在你外面，当我在美国北部，我可以支付我的东西。,1.0,0.8145784269997117,0.00616705385283182,"Cartão no exterior. Quando tiver na América do Norte, posso pagar as minhas coisas.",0.0,1.1319261113330867,0.006304944195669926,6010.40869140625,False
pt-PT~PAY_BILL/response_7.wav,Bom dia a fatura do meu cartão de crédito está vencido,bom dia a fatura do meu cartão de crédito está vencido,"Bon dia, a factura de meu cartão de crédito está vencida.",0.36363636363636365,0.8979761643337648,0.006982772470231521,"Bom dia, a factura do meu cartão de crédito está vencida.",0.18181818181818182,0.9063566446669332,0.002619007418811844,6010.40869140625,False
pt-PT~JOINT_ACCOUNT/CAc83c7be23c5a7886274d082c13b671b7_0.wav,Olá muito boa tarde eu gostaria de criar uma conta conjunta com o meu namorado e gostaria de saber como é que como é que isso processo pronto como é que eu posso fazer e porquanto não posso raio que não não consegui ficar a compreender e gostaria de ter a vossa ajuda para para este sério obrigada,olá muito boa tarde eu gostaria de criar uma conta conjunta com o meu namorado e gostaria de saber como é que como é que isso processo pronto como é que eu posso fazer e porquanto não posso raio que não não consegui ficar a compreender e gostaria de ter a vossa ajuda para para este sério obrigada,"Alô, muito boa tarde. Eu gostaria de criar uma conta conjunta com o meu namorado e gostaria de saber como é que esse processo acontece, como é que eu posso fazer e porque, no vosso site, não consegui ficar a compreender e gostaria de ter a vossa ajuda para este processo. Obrigado.",0.25862068965517243,3.6378070383331456,0.0012245797598242172,"Alô, muito boa tarde. Eu gostaria de criar uma conta conjunta com o meu namorado e gostaria de saber como é que esse processo, por exemplo, como é que eu posso fazer? E porque, no vosso site, não consegui ficar a compreender e gostaria de ter a vossa ajuda para este processo. Obrigado.",0.27586206896551724,3.7262612800001684,0.0022840231442425277,6010.40869140625,False
pt-PT~FREEZE/CA31d00278161d3d1251965e76f94910e9_0.wav,bom dia eu gostava de cancelar o meu cartão cidadão vosso Bangu,bom dia eu gostava de cancelar o meu cartão cidadão vosso bangu,"Um dia, eu gostava de cancelar o meu cartão associado ao vosso banco.",0.3333333333333333,1.0971457723335334,0.008911333572143031,"Um dia, eu gostava de cancelar o meu cartão associado ao vosso banco.",0.3333333333333333,1.1186359326669237,0.007257813367966507,6010.40869140625,False
pt-PT~ABROAD/CA8c08c39f2d45a5a40eb68bb5426fe63e_2.wav,eu tenho cartão de banho e preciso de usar fora do país Posso ir bem Eu preciso do meu cartão no exterior,eu tenho cartão de banho e preciso de usar fora do país posso ir bem eu preciso do meu cartão no exterior,"Eu tenho um cartão de banco e preciso de usar fora do meu país. Eu preciso do meu cartão no exterior. Olá, sim, vocês estão?",0.45454545454545453,1.9028743716662575,0.0022592703407733968,"Eu tenho um cartão de banco e preciso de usar fora do meu país. Eu preciso do meu cartão no exterior. Olá, sim, vocês estão preenchendo?",0.5,2.025958873666544,0.0057030486377125334,6010.40869140625,False
pt-PT~ATM_LIMIT/CA34c8f83200881f062b626e2e30c92c35_0.wav,Qual é o alimento na caixa eletrónica não está no meu limite só que na caixa eletrónico Quanto dinheiro Posso retirar quero que tirar dinheiro do Caixa eletrônico Qual é o meu limite Quanto dinheiro Posso retirar Quanto dinheiro Posso retirar dinheiro,qual é o alimento na caixa eletrónica não está no meu limite só que na caixa eletrónico quanto dinheiro posso retirar quero que tirar dinheiro do caixa eletrônico qual é o meu limite quanto dinheiro posso retirar quanto dinheiro posso retirar dinheiro,Qual é o meu limite na caixa eletrônica? Posso aumentar o meu limite de saque na caixa eletrônica? Quanto dinheiro posso retirar? Quero retirar dinheiro do caixa eletrônico. Qual é o meu limite? Quanto dinheiro posso retirar? Quanto dinheiro posso retirar? Posso aumentar o meu limite de saque no caixa eletrônico? Quanto dinheiro posso retirar?,0.5714285714285714,4.714318513333637,0.019073065583967916,Qual é o meu limite na caixa eletrônica? Posso aumentar o meu limite de saque na caixa eletrônica? Quanto dinheiro posso retirar? Quero retirar dinheiro do caixa eletrônico. Qual é o meu limite? Quanto dinheiro posso retirar? Quanto dinheiro posso retirar? Posso aumentar o meu limite de saque no caixa eletrônico? Quanto dinheiro posso retirar?,0.5714285714285714,4.722896744333411,0.06156056662912695,6010.40869140625,False
pt-PT~PAY_BILL/response_24.wav,Bom dia eu estou aqui a tentar pagar uma conta da luz e diz aqui que a fatura do meu cartão de crédito está vencida Mas eu acho que isso não deve estar correto já conseguiu me ajudar,bom dia eu estou aqui a tentar pagar uma conta da luz e diz aqui que a fatura do meu cartão de crédito está vencida mas eu acho que isso não deve estar correto já conseguiu me ajudar,"Bonjou, I'm here trying to pay a bill for electricity and it says here that my credit card bill is overdue but I think this should not be correct. Could you please help me?",0.9736842105263158,1.9278370859998784,0.014228688832195106,"Bom dia, eu estou aqui a tentar pagar uma conta da luz e diz aqui que a fatura do meu cartão de crédito está vencida, mas eu acho que isso não deve estar correto. Sabe que me podem ajudar?",0.07894736842105263,2.522046536999975,0.008906118932843541,6010.40869140625,False
pt-PT~HIGH_VALUE_PAYMENT/response_21.wav,Bom dia Estou a tentar fazer o pagamento online e diz que manda uma mensagem mas não recebi nenhuma ocupado fazer obrigada,bom dia estou a tentar fazer o pagamento online e diz que manda uma mensagem mas não recebi nenhuma ocupado fazer obrigada,"Um dia, tá tentando fazer um pagamento online e diz que mandou uma mensagem, mas não recebo nenhuma. O que posso fazer? Obrigado.",0.5,1.7473993540000567,0.01066516596946128,"Bom dia, estou a tentar fazer um pagamento online e diz que envia uma mensagem, mas não recebo nenhuma. O que posso fazer? Obrigado.",0.3181818181818182,1.8750064863334046,0.011184249277721993,6010.40869140625,False
pt-PT~DIRECT_DEBIT/CAdc0d52dd4c9c636f5526adbd45548603_0.wav,Olá eu tinha feito o débito directo eu gostava que me mostrasse os meus débitos e ter falar um pouco sobre os débitos diretos que estava devolver a dizer assim,olá eu tinha feito o débito directo eu gostava que me mostrasse os meus débitos e ter falar um pouco sobre os débitos diretos que estava devolver a dizer assim,"Hello, I've been making a direct debit to your bank and I wanted to ask you about the monthly debits and I wanted to talk a little bit about the monthly debits direct and then I was wondering if you could answer my direct debit.",1.5,2.357186232999993,0.02581305177020989,"Olá, eu tenho feito um débito direto no seu banco, no vosso banco, e eu gostava de mostrar que eu tenho tantos débitos e eu queria falar um pouco sobre os débitos diretos e, principalmente, eu gostava de voltar a ver um débito direto.",0.9333333333333333,3.3550704380001357,0.0325365943221962,6010.40869140625,False
pt-PT~DIRECT_DEBIT/response_9.wav,Quanto tempo demora a associar o David direto a ser aprovado para perceber,quanto tempo demora a associar o david direto a ser aprovado para perceber,Quanto tempo demora a associar o débito direto a ser aprovado para poder retirar o dinheiro?,0.38461538461538464,1.3241323533332736,0.019931389644172494,Quanto tempo demora a associar o débito direto a ser aprovado para poder retirar o dinheiro?,0.38461538461538464,1.3028643993332782,0.009322077874822917,6010.40869140625,False
pt-PT~ABROAD/CA20b69d86edd384e3803aff9ece6c9c03_2.wav,Boa tarde gostaria de saber se o meu cartão funciona no estrangeiro,boa tarde gostaria de saber se o meu cartão funciona no estrangeiro,"Buenos días, ¿quisiera saber si mi tarjeta funciona en el extranjero?",0.9166666666666666,1.0485256163331844,0.005990748622418907,"Boa tarde, eu gostaria de saber se a carteira funciona no estrangeiro.",0.3333333333333333,0.9969465706669022,0.005192210276883957,6010.40869140625,False
pt-PT~ABROAD/CAe29689bc7ea0f4101143506baf8d68fe_2.wav,posso pagar as minhas coisas quando estou na América,posso pagar as minhas coisas quando estou na américa,Pouso pagar as minhas coisas quando estou na América?,0.1111111111111111,0.8111730880000323,0.004629115582664135,Pode pagar as minhas coisas quando estou na América?,0.1111111111111111,0.7691727956671457,0.009141111019658773,6010.40869140625,False
pt-PT~CASH_DEPOSIT/CA472b76da9372b67a022b7fd25570b451_0.wav,Como faço para transferir dinheiro para a conta,como faço para transferir dinheiro para a conta,Como faço para transferir dinheiro para a conta?,0.0,0.654211707333161,0.01663004269826922,Como faço para transferir dinheiro para a conta,0.0,0.6038294213331028,0.019508430957202536,6010.40869140625,False
pt-PT~BALANCE/CAf7bb03f0590eaea1f9108eaa41ce4131_0.wav,Olá boa tarde Eu queria saber o saldo da conta o saldo atual da conta por favor,olá boa tarde eu queria saber o saldo da conta o saldo atual da conta por favor,我把它都给它写成一个总的函数，总的函数是吧？,1.0,0.8706736070001474,0.0120249259180666,我把它都给写在了这个账号上，这个账号上。,1.0,0.8156156420000116,0.005002310750679079,6010.40869140625,False
pt-PT~FREEZE/CAfe0e00ab028de8e859adbaa7db0bdf9c_6.wav,eu desejo congelar o meu cartão,eu desejo congelar o meu cartão,我想要一个。,1.0,0.3335259156668447,0.0016648191087011857,Eu desejo congelar o meu cartão.,0.0,0.6437695353333766,0.002490311201771178,6010.40869140625,False
pt-PT~JOINT_ACCOUNT/CAd0443f4438f84f42d4da96a094dd627c_3.wav,Gostaria de saber como é que consigo configurar uma conta conjunta,gostaria de saber como é que consigo configurar uma conta conjunta,Gostaria de saber como é que consigo configurar uma conta conjunta. O que é que tenho que fazer para configurar essa conta conjunta?,1.0909090909090908,1.7076048123329504,0.03245566902611318,Gostaria de saber como é que consigo configurar uma conta conjunta. O que é que tenho que fazer para configurar essa conta conjunta?,1.0909090909090908,1.6899031206664101,0.003786413724902332,6010.40869140625,False
pt-PT~JOINT_ACCOUNT/response_4.wav,Boa tarde Queria criar uma conta conjunta com a minha esposa mas não sei como fazer para que me podia dar informações sobre o procedimento,boa tarde queria criar uma conta conjunta com a minha esposa mas não sei como fazer para que me podia dar informações sobre o procedimento,"Bom tarde, queria criar uma conta conjunta com a minha esposa, mas não sei como o fazer. Será que eu poderia dar informações sobre o procedimento?",0.2,1.7518193053335078,0.007731946160332944,"Bom tarde, queria criar uma conta conjunta com a minha esposa, mas não sei como o fazer. Será que eu poderia dar informações sobre o procedimento?",0.2,1.7745334946663813,0.019437867765653594,6010.40869140625,False
pt-PT~ADDRESS/response_19.wav,Olá bom dia eu gostaria de alterar o endereço A minha morada o mais rápido possível por favor,olá bom dia eu gostaria de alterar o endereço a minha morada o mais rápido possível por favor,"Hala, bon di, j'aimerais changer l'adresse de ma mère au plus vite possible, s'il vous plaît.",1.0,1.4284506653330027,0.005233112440095675,"Hala, bon dia. Eu gostaria de alterar o endereço da minha morada o mais rápido possível, por favor.",0.16666666666666666,1.3348630796669265,0.016152338442914776,6010.40869140625,False
pt-PT~BALANCE/CA09aeeb1fc567a9d59e4d25d84c956372_0.wav,Olá boa tarde eu gostaria de ter alguma informação sobre o saldo da minha conta e a mente o saldo atual seria possível mostrar o saldo da minha conta Por favor,olá boa tarde eu gostaria de ter alguma informação sobre o saldo da minha conta e a mente o saldo atual seria possível mostrar o saldo da minha conta por favor,"Hello, good afternoon. I would like to have some information about the balance of my account, namely the current balance. Would it be possible to show me the balance of my account, please?",1.064516129032258,1.8831805989996913,0.007567379093810614,"Olá, boa tarde. Eu gostaria de ter alguma informação sobre o saldo da minha conta, nomeadamente o saldo atual. Seria possível mostrar-me o saldo da minha conta, por favor?",0.12903225806451613,1.9806600789997901,0.004597223333321267,6010.40869140625,False
pt-PT~ABROAD/CAf70be20fff527ed2a53b9434f7012d18_5.wav,Não eu preciso saber o meu cartão funciona quando estiver no exterior,não eu preciso saber o meu cartão funciona quando estiver no exterior,"No, eu preciso saber se o meu cartão funciona quando eu estiver no exterior.",0.25,1.026151663333015,0.018491124542424468,"Não, eu preciso saber se meu cartão funciona quando eu estiver no exterior.",0.16666666666666666,0.9920932946667259,0.008010875646976638,6010.40869140625,False
pt-PT~CARD_ISSUES/response_26.wav,Bom dia estou a ligar porque estou a tentar fazer pagamentos com o meu cartão e o meu cartão não funciona eu gostava de saber se me poderiam ajudar o que é que eu posso fazer para resolver o problema,bom dia estou a ligar porque estou a tentar fazer pagamentos com o meu cartão e o meu cartão não funciona eu gostava de saber se me poderiam ajudar o que é que eu posso fazer para resolver o problema,Good day. I'm calling because I'm trying to make payments with my card and my card doesn't work and I'd like to know if you could help me or what I can do to resolve the problem.,1.0,2.07084695900024,0.024432746160763744,"Bom dia, eu estou ligar porque estou a tentar fazer pagamentos com o meu cartão e o meu cartão não funciona e eu gostava de saber se me poderiam ajudar ou o que é que eu posso fazer para resolver o problema.",0.1,2.634953581000142,0.032120961223380276,6010.40869140625,False
pt-PT~FREEZE/CA68ffb25799b7542f8b66cf53928694d4_3.wav,bom eu gostaria neste momento de cancelar o meu cartão que tem com o vosso banco,bom eu gostaria neste momento de cancelar o meu cartão que tem com o vosso banco,嗯，我就是说嗯嗯嗯嗯嗯嗯嗯嗯嗯嗯嗯嗯嗯嗯嗯嗯嗯嗯嗯嗯嗯嗯嗯嗯嗯嗯嗯嗯嗯嗯嗯嗯嗯嗯嗯嗯嗯嗯嗯嗯嗯嗯嗯嗯嗯嗯嗯嗯嗯嗯嗯嗯嗯嗯嗯嗯嗯嗯嗯嗯嗯嗯嗯嗯嗯嗯嗯嗯嗯嗯嗯嗯嗯嗯嗯嗯嗯嗯嗯嗯嗯嗯嗯嗯嗯嗯嗯嗯嗯嗯嗯嗯嗯嗯嗯嗯嗯嗯嗯嗯嗯嗯嗯嗯嗯嗯嗯嗯嗯嗯嗯嗯嗯嗯嗯嗯嗯嗯嗯嗯嗯嗯嗯嗯嗯嗯嗯嗯嗯嗯嗯嗯嗯嗯嗯嗯嗯嗯嗯嗯嗯嗯嗯嗯嗯嗯嗯嗯嗯嗯嗯嗯嗯嗯嗯嗯嗯嗯嗯嗯嗯嗯嗯嗯嗯嗯嗯嗯嗯嗯嗯嗯嗯嗯嗯嗯嗯嗯嗯嗯嗯嗯嗯嗯嗯嗯嗯嗯嗯嗯嗯嗯嗯嗯嗯嗯嗯嗯嗯嗯嗯嗯嗯嗯嗯嗯嗯嗯嗯嗯嗯嗯嗯嗯嗯嗯嗯嗯嗯嗯嗯嗯嗯嗯嗯嗯嗯嗯嗯嗯嗯嗯嗯嗯嗯嗯嗯嗯嗯嗯嗯嗯嗯嗯嗯嗯嗯嗯嗯嗯嗯,1.0,11.484891871666454,0.012181895048407032,Qualquer coisa. Qualquer coisa. Qualquer coisa. Qualquer coisa. Qualquer coisa. Qualquer coisa. Qualquer coisa. Qualquer coisa. Qualquer coisa. Qualquer coisa. Qualquer coisa. Qualquer coisa. Qualquer coisa. Qualquer coisa. Qualquer coisa. Qualquer coisa. Qualquer coisa. Qualquer coisa. Qualquer coisa. Qualquer coisa. Qualquer coisa. Qualquer coisa. Qualquer coisa. Qualquer coisa. Qualquer coisa. Qualquer coisa. Qualquer coisa. Qualquer coisa. Qualquer coisa. Qualquer coisa. Qualquer coisa. Qualquer coisa. Qualquer coisa. Qualquer coisa. Qualquer coisa. Qualquer coisa. Qualquer coisa. Qualquer coisa. Qualquer coisa. Qualquer coisa. Qualquer coisa. Qualquer coisa. Qualquer coisa. Qualquer coisa. Qualquer coisa. Qualquer coisa. Qualquer coisa. Qualquer coisa. Qualquer coisa. Qualquer coisa. Qualquer coisa. Qualquer coisa. Qualquer coisa. Qualquer coisa. Qualquer coisa. Qualquer coisa. Qualquer coisa. Qualquer coisa. Qualquer coisa. Qualquer coisa. Qualquer coisa. Qualquer coisa. Qualquer coisa. Qualquer coisa.,8.0,11.472975467333223,0.03164219250309801,6010.40869140625,False
pt-PT~ABROAD/CA69a43563017b52900eec1d59305a54da_1.wav,muito bom dia eu tenho um cartão no meu banco e queria saber se ele também funciona no exterior e queria saber se posso pagar as coisas quando estou por exemplo nos Estados Unidos da América,muito bom dia eu tenho um cartão no meu banco e queria saber se ele também funciona no exterior e queria saber se posso pagar as coisas quando estou por exemplo nos estados unidos da américa,"Muito bom dia, tenho um cartão no meu banco e quero saber se ele também funciona no exterior. Queria saber se posso pagar as coisas quando estou, por exemplo, nos Estados Unidos da América.",0.08333333333333333,2.237674349666728,0.0014134973406310502,"Muito bom dia, tenho um cartão no meu banco e quero saber se ele também funciona no exterior. Queria saber se posso pagar as coisas quando estou, por exemplo, nos Estados Unidos da América.",0.08333333333333333,2.247445039666976,0.002600081932430447,6010.40869140625,False
pt-PT~DIRECT_DEBIT/response_19.wav,mostrar meus débitos diretos,mostrar meus débitos diretos,Mostrar meus débitos diretos.,0.0,0.5858302053332712,0.00400357085128342,Mostrar meus débitos diretos.,0.0,0.5739677693333457,0.0029777145524081242,6010.40869140625,False
pt-PT~ATM_LIMIT/CA882e8c0644f7f3a64b5aa2b42fb7508e_0.wav,Continente quanto dinheiro posso retirar,continente quanto dinheiro posso retirar,"Quanto dinheiro, quanto dinheiro pôs retirar?",0.6,0.6747652006664188,0.003209743809259873,"Quanto dinheiro, quanto dinheiro pôs retirar?",0.6,0.6834923440001148,0.010977305793316565,6010.40869140625,False
