sample_id,reference_raw,reference_norm,hypothesis_A_original,wer_A_original,latency_mean_A_original,latency_std_A_original,hypothesis_B_pt_pinned,wer_B_pt_pinned,latency_mean_B_pt_pinned,latency_std_B_pt_pinned,peak_vram_mb,quantized
pt-PT~FREEZE/response_13.wav,Olá bom dia estou a ligar com o Diogo é uma com o meu cartão e gostaria de saber como é que posso fazer O que é que é possível de fazer para cancelar ou para congelar o meu cartão de forma não haver mais nenhum movimento em transação por favor,olá bom dia estou a ligar com o diogo é uma com o meu cartão e gostaria de saber como é que posso fazer o que é que é possível de fazer para cancelar ou para congelar o meu cartão de forma não haver mais nenhum movimento em transação por favor,"Alô, bom dia. Eu estou a ligar porque tenho um problema com o meu cartão e gostaria de saber como é que posso fazer ou o que é que é possível de fazer para cancelar ou para congelar o meu cartão de forma a não haver mais nenhum movimento em transação, por favor.",0.17647058823529413,3.2810430510004758,0.01736223983181891,"Alô, bom dia. Eu estou ligando porque eu tenho um problema com o meu cartão e gostaria de saber como é que posso fazer ou o que é que é possível de fazer para cancelar ou para congelar o meu cartão de forma a não haver mais nenhum movimento em transação, por favor.",0.21568627450980393,3.3075623760002295,0.03785130742451146,15783.193359375,False
pt-PT~LATEST_TRANSACTIONS/CAf2aa6ae60f94a8de85cdf160289f81d2_3.wav,Eu gostava de ver as minhas transações recentes,eu gostava de ver as minhas transações recentes,我有在看我的交易。,1.0,0.4583810623335012,0.0035798163454424142,Eu gostava de ver as minhas transações recentes.,0.0,0.7201966996672127,0.005754953557514754,15783.193359375,False
pt-PT~HIGH_VALUE_PAYMENT/response_38.wav,tava a ligar porque precisava de fazer um grande pagamento online e está a dizer que eu preciso para receber uma mensagem de texto Não sei o que é que é preciso fazer Precisava da vossa ajuda para me ajudar a passar o pagamento,tava a ligar porque precisava de fazer um grande pagamento online e está a dizer que eu preciso para receber uma mensagem de texto não sei o que é que é preciso fazer precisava da vossa ajuda para me ajudar a passar o pagamento,I was trying to call because I needed to make a big online payment and he's saying that I need to receive a text message and I don't know what I need to do. I needed your help to process the payment.,1.0,2.1476069983333823,0.023223491156082677,"Qualquer coisa, eu estava ligando porque eu precisava de fazer um grande pagamento online e está dizendo que eu preciso de receber um mensagem de texto. Não sei o que é que eu preciso fazer. Eu precisava da sua ajuda para me ajudar a processar o pagamento.",0.3181818181818182,2.8134867053328585,0.02463405593038175,15783.193359375,False
pt-PT~BALANCE/response_4.wav,mostre-me o saldo da minha conta,mostreme o saldo da minha conta,Most must have gone on your account.,1.1666666666666667,0.499905445333449,0.0049532586045475755,Most um salva no meu conta.,0.8333333333333334,0.49053506566633587,0.000556089247371645,15783.193359375,False
pt-PT~JOINT_ACCOUNT/response_31.wav,Boa tarde poderia explicar-me Como é que faço para configurar uma conta conjunta obrigada,boa tarde poderia explicarme como é que faço para configurar uma conta conjunta obrigada,"Boa tarde, poderia explicar-me como é que faço para configurar uma conta conjunta? Obrigado.",0.07142857142857142,1.2681515553340432,0.0037462690521723437,"Boa tarde, poderia explicar-me como é que faço para configurar uma conta conjunta? Obrigado.",0.07142857142857142,1.277377815333845,0.013545950199163838,15783.193359375,False
pt-PT~BUSINESS_LOAN/response_4.wav,Bom dia a estou a ligar porque tenho um empréstimo comercial e eu queria saber quando é que são as especificações para abrir um novo e se posso ter dois empréstimos comerciais ao mesmo tempo obrigado,bom dia a estou a ligar porque tenho um empréstimo comercial e eu queria saber quando é que são as especificações para abrir um novo e se posso ter dois empréstimos comerciais ao mesmo tempo obrigado,"Bom dia, estou ligado porque tenho um empréstimo comercial e eu queria saber quais são as especificações para abrir um novo e se posso ter dois empréstimos comerciais ao mesmo tempo. Obrigado.",0.16666666666666666,2.4216468459999305,0.03467199041182169,"Qual é o dia? Estou ligar porque tenho um empréstimo comercial e eu queria saber quais são as especificações para abrir um novo, e se posso ter dois empréstimos comerciais ao mesmo tempo. Obrigado.",0.2222222222222222,2.5019946616666857,0.010237872140750103,15783.193359375,False
pt-PT~HIGH_VALUE_PAYMENT/CA939d05b1d67639671b874e557350c19f_0.wav,Olá boa tarde diga-me para fazer um pagamento online e ele também não consegues são e ao mesmo tempo recebendo as mensagens telefone na cara um pouco mais que isso funciona,olá boa tarde digame para fazer um pagamento online e ele também não consegues são e ao mesmo tempo recebendo as mensagens telefone na cara um pouco mais que isso funciona,"Hello, good afternoon. I'm trying to do a payment online and he's telling me some scories, but I don't know what they are. And at the same time, I'm receiving messages on my phone that are very strange. Could you explain a little bit more how this works?",1.5161290322580645,2.7613267336661615,0.0010567472470411842,"Olá, boa tarde. Eu estou tentando fazer um pagamento online e ele tá me dizendo que são fraudes, só que eu não sei o que são e ao mesmo tempo eu tô recebendo as mensagens de um celular que estão todas roscadas. Podemos explicar um pouco mais como é que isso funciona?",0.9032258064516129,3.176997501999722,0.005879262424952569,15783.193359375,False
pt-PT~DIRECT_DEBIT/response_18.wav,Olá boa tarde Estou a ligar porque tenho as perguntas relações com os débitos diretos e gostava que me Explicassem primeiro Como funciona o que são os débitos diretos Como é que eu poderei ter acesso aos débitos diretos e Caso seja necessário Como é que poderá proceder a devolução Então de um débito direto obrigado,olá boa tarde estou a ligar porque tenho as perguntas relações com os débitos diretos e gostava que me explicassem primeiro como funciona o que são os débitos diretos como é que eu poderei ter acesso aos débitos diretos e caso seja necessário como é que poderá proceder a devolução então de um débito direto obrigado,"Hello, good afternoon. I'm here to call because I have some questions related to direct debits and I would like you to explain first how it works, what are the direct debits, how I can have access to direct debits and, if necessary, how I can proceed with the dissolution of a direct debit. Thank you.",1.0,3.126620944332899,0.008696625656169172,"Qualquer coisa. Boa tarde. Eu estou a ligar porque tenho algumas perguntas relacionadas com os débitos diretos e eu gostava que me explicassem, primeiro, como funciona, o que são os débitos diretos, como é que eu poderia ter acesso aos débitos diretos e, caso seja necessário, como é que eu poderia proceder à dissolução, então, de um débito direto. Obrigado.",0.19642857142857142,4.543574510666683,0.0010658750168886686,15783.193359375,False
pt-PT~BALANCE/response_35.wav,Estou sim Estou a contactar porque tenho de saber o saldo da conta da minha conta Se pudesse mostrar eu agradecia muito obrigado,estou sim estou a contactar porque tenho de saber o saldo da conta da minha conta se pudesse mostrar eu agradecia muito obrigado,"Estou assim, eu estou a contactar porque queria, pretendia saber o saldo da, da conta, da, da minha conta. Se, se pudesse mostrar, eu agradeço muito obrigado.",0.34782608695652173,2.097749709332978,0.007402332325112701,"Estou assim, eu estou a contactar porque eu queria, pretendia saber o saldo da, da conta, da, da minha conta. Se, se pudesse mostrar, eu agradeço muito obrigado.",0.391304347826087,2.163636128000386,0.011115474679738358,15783.193359375,False
pt-PT~ABROAD/CA0af2f6287d471032addb4b0d879a7d94_3.wav,Como é que posso usar este cartão exterior,como é que posso usar este cartão exterior,Como é que posso usar este cartão exterior?,0.0,0.6280716129998231,0.006784935511682476,Como é que posso usar este cartão exterior?,0.0,0.6238258329995006,0.0012168825572236692,15783.193359375,False
pt-PT~JOINT_ACCOUNT/response_30.wav,Como é que eu faço configurar uma conta conjunta não é que pode ter conta de uma parceira Onde é que posso ver no colectivo opção do contente,como é que eu faço configurar uma conta conjunta não é que pode ter conta de uma parceira onde é que posso ver no colectivo opção do contente,"Como é que eu faço para configurar uma conta conjunta? Sempre que posso ter uma conta do meu parceiro, onde é que posso ver no aplicativo a opção de conta em conjunção?",0.5,2.157262203999077,0.009247855229466289,"Como é que eu faço para configurar uma conta conjunta? Sempre que posso ter uma conta do meu parceiro, onde é que posso ver no aplicativo a opção de conta em conjunta?",0.5,2.104578249000648,0.004490287769395961,15783.193359375,False
pt-PT~ABROAD/CA3b1b8da772a8ce668baebb999a16a09f_4.wav,eu preciso do meu cartão no exterior,eu preciso do meu cartão no exterior,Eu preciso do meu cartão no exterior.,0.0,0.5822505683336203,0.003340032265189634,Eu preciso do meu cartão no exterior.,0.0,0.5956938083333322,0.013025520120135569,15783.193359375,False
pt-PT~BALANCE/response_7.wav,Qual é o saldo da minha conta,qual é o saldo da minha conta,Qual é o saldo da minha conta?,0.0,0.5538548283329874,0.006252947243328427,Qual é o saldo da minha conta,0.0,0.45943068566703005,0.014316417187602066,15783.193359375,False
pt-PT~ABROAD/CA5719e2617ea4eb62447cba4238fdbd98_4.wav,Olá eu preciso de usar o meu cartão do exterior,olá eu preciso de usar o meu cartão do exterior,你好，我需要使用我的卡在外部,1.0,0.6125092476668215,0.006463059643298399,"Hela, eu preciso de usar o meu cartão no exterior.",0.2,0.8748654699999557,0.004403284112582536,15783.193359375,False
pt-PT~CASH_DEPOSIT/response_7.wav,Como é que faço para colocar dinheiro própria conta,como é que faço para colocar dinheiro própria conta,怎么快速把呃酷跑的那些他们靠谱的款,1.0,0.666479377666595,0.004267873060646664,Come on fast for a cool carding and then a proper one.,1.3333333333333333,0.7470765443334434,0.000987153147953624,15783.193359375,False
pt-PT~ABROAD/CA265a820dff5459780b4673c3ae89e7df_2.wav,posso pagar as coisas quando estou na América,posso pagar as coisas quando estou na américa,Pouso pagar as coisas quando estou na América?,0.125,0.7196878579992093,0.004202252176598878,Pouso pagar as coisas quando estou na América?,0.125,0.7204000300001402,0.0005822406093838286,15783.193359375,False
pt-PT~ADDRESS/response_18.wav,Bom dia queria mudar o meu endereço,bom dia queria mudar o meu endereço,"Pandilla, quero mudar o meu endereço.",0.42857142857142855,0.7021332756667107,0.001349988243539812,"Pandia, queria mudar o meu endereço.",0.2857142857142857,0.7013946159998644,0.0019617863059044277,15783.193359375,False
pt-PT~ADDRESS/CA6f91aa83792e208957f021ec365a69fd_0.wav,Eu preciso de mudar o meu endereço,eu preciso de mudar o meu endereço,呃，我我需要你给我一个地址。,1.0,0.5835039853324512,0.0017406601038218205,呃，我我需要你给我一个地址。,1.0,0.5726278573341309,0.0033028621334361846,15783.193359375,False
pt-PT~CASH_DEPOSIT/CA3297da62621739854b3b1a442e832f52_3.wav,Eu precisava de fazer um depósito na minha conta,eu precisava de fazer um depósito na minha conta,我需要在账户上存入一笔资金。,1.0,0.5812940000002224,0.006783462204432153,Eu precisava de fazer um depósito na minha conta.,0.0,0.6825555316657604,0.007129233321688278,15783.193359375,False
pt-PT~JOINT_ACCOUNT/CA72f123b725e5fff7e4be1ef8f61cd9b9_2.wav,ligar porque é que cada uma configurar uma conta conjunta com a minha mãe mas não estou aqui embora aplicativo a opção para criar uma conta conjunta Gostava de saber o que é que como é que você dia Catarina opções,ligar porque é que cada uma configurar uma conta conjunta com a minha mãe mas não estou aqui embora aplicativo a opção para criar uma conta conjunta gostava de saber o que é que como é que você dia catarina opções,"Foi ligar porque quero fazer uma configuração de conta conjunta com a minha mãe, mas não estou aqui a encontrar na aplicativo a opção para criar uma conta conjunta. Gostava de saber o que é que, o que que, o que é como é que eu acedia a tal as opções.",0.4878048780487805,3.2432227050000315,0.00588412409652139,"Fui ligar porque quero fazer uma configuração de conta conjunta com a minha mãe, mas não estou aqui a encontrar na aplicativo a opção para criar uma conta conjunta. Gostava de saber o que é que, o que que, onde é como é que eu acedia a tal e as opções.",0.4878048780487805,3.258234112333715,0.025427413262201545,15783.193359375,False
pt-PT~ADDRESS/response_2.wav,Boa tarde eu estou farto bem Eu gostava muito de levar no endereço,boa tarde eu estou farto bem eu gostava muito de levar no endereço,保持。,1.0,0.23219513000003644,0.0026002654700747847,"Boa tarde, estou falando com um amigo que gostava de mudar o meu endereço.",0.7692307692307693,1.1051319113327434,0.006361490062469932,15783.193359375,False
pt-PT~DIRECT_DEBIT/response_24.wav,mostra-me os meus débitos diretos,mostrame os meus débitos diretos,Mostrame Usmeus de vich direct.,0.8,0.6495074606664275,0.007458102603966022,Mostra-me o seu zavitch direc.,0.8,0.6234756256671972,0.0012340861103993005,15783.193359375,False
pt-PT~ADDRESS/response_40.wav,Eu quero mudar meu endereço,eu quero mudar meu endereço,你想要修改我的地址,1.0,0.3670639556670115,0.0013546559180535156,你想要修改我的地址,1.0,0.36128529066688014,0.0018559089644383715,15783.193359375,False
pt-PT~ABROAD/CA6f601408612d7e7b3990dff73d705572_3.wav,Olá boa tarde O que se passa que eu fiquei com o meu cartão no vosso banco e vou para o estrangeiro e eu precisava de saber se o cartão também funcionava no estrangeiro,olá boa tarde o que se passa que eu fiquei com o meu cartão no vosso banco e vou para o estrangeiro e eu precisava de saber se o cartão também funcionava no estrangeiro,"Hello, good afternoon. What's happening is that I kept with my card in your bank and I go to the foreigner and I needed to know if the card also functioned in the foreigner. Is this fine? Good afternoon.",1.1470588235294117,2.2582560059987977,0.013100610363301235,"Bom dia. O que se passa é que eu fiquei com o meu cartão no vosso banco e vou para o estrangeiro e eu precisava de saber se o cartão também funcionava no estrangeiro. Isso sim, bom tarde.",0.23529411764705882,2.6260142673339337,0.024426981320579622,15783.193359375,False
pt-PT~ABROAD/CA1b7193376193c16d03f90e133d2f13c5_2.wav,Portanto eu tenho cartão do meu banco e gostaria de saber se ele também funciona no estrangeiro no exterior,portanto eu tenho cartão do meu banco e gostaria de saber se ele também funciona no estrangeiro no exterior,"Therefore, I have a card from my bank and I would like to know if it also works in the foreign, in the exterior. It is necessary.",1.368421052631579,1.4962412616666068,0.0027057672525249462,"Portanto, eu tenho um cartão do meu banco e gostaria de saber se ele também funciona no estrangeiro, no exterior. Eu preciso",0.15789473684210525,1.5525856150003772,0.013808269737463888,15783.193359375,False
pt-PT~FREEZE/response_30.wav,desejo congelar o meu cartão e como tal pretendo interromper todas as transações,desejo congelar o meu cartão e como tal pretendo interromper todas as transações,Desejo congelar o meu cartão e como tal pretendo interromper todas as transações.,0.0,1.1462587993337365,0.005331066094453472,Desejo congelar o meu cartão e como tal pretendo interromper todas as transações.,0.0,1.145590124999823,0.0016495321586518289,15783.193359375,False
pt-PT~ABROAD/CA9f42886680d043e41e45afd9aad2cfdc_0.wav,Olha eu eu tenho um cartão no seu banco e eu queria saber se eu consigo usar esse cartão no estrangeiro,olha eu eu tenho um cartão no seu banco e eu queria saber se eu consigo usar esse cartão no estrangeiro,"Look, I have a card in your bank. I want to know if I can use this card abroad.",1.0,1.1307683469998058,0.010011512665702382,Qual é o meu cartão? Eu tenho um cartão no seu banco. Eu queria saber se eu consigo usar esse cartão no estrangeiro.,0.2857142857142857,1.6192631703330942,0.009686097367208287,15783.193359375,False
pt-PT~DIRECT_DEBIT/CA6ad550315d63131e6b77f9fd6072d643_0.wav,Bom dia queria fazer uma pergunta sobre deves diretos diga-me Quais são os seus débitos diretos e tipo calções é que tem é que pudesse fazer Que tipo de vantagens e desvantagens é que tem qual é o tipo de cão e tantas que é isso nunca muito mais é que hei de fazer esta pergunta na tanto,bom dia queria fazer uma pergunta sobre deves diretos digame quais são os seus débitos diretos e tipo calções é que tem é que pudesse fazer que tipo de vantagens e desvantagens é que tem qual é o tipo de cão e tantas que é isso nunca muito mais é que hei de fazer esta pergunta na tanto,"Um, bom dia. Gostaria de fazer uma pergunta sobre débitos diretos. Diga-me quais são, então, esses débitos diretos e o que tipo de opções ele tem? O que eu poderia fazer? O que tipo de vantagens, de vantagens ele tem? Qual é o tipo de? E, portanto, acho que é isso. Não sei muito mais aqui, pois fazer essa pergunta, tanto o.",0.5344827586206896,4.502985306666839,0.013204385448002964,"Bom dia. Gostaria de fazer uma pergunta sobre débitos diretos. Diga-me, quais são, então, esses débitos diretos? E qual tipo de opções ele tem? O que é que eu posso fazer? Qual tipo de vantagens e de vantagens ele tem? Qual é o tipo de... Qual é a sua escolha? Qual é a sua escolha? E portanto, acho que é isso. Não sei muito mais aqui, pois eu fiz essa pergunta. Mas tanto...",0.6551724137931034,5.146730516333871,0.0084967888888123,15783.193359375,False
pt-PT~BUSINESS_LOAN/CAdf502834c25b295149874121099c49ce_0.wav,olá e eu gostava de tentar perceber como é que funciona aquela notícia que saiu sobre o empréstimo empréstimo comercial que já existe mas que não ficas com ácido,olá e eu gostava de tentar perceber como é que funciona aquela notícia que saiu sobre o empréstimo empréstimo comercial que já existe mas que não ficas com ácido,"Pronto, um, Olá, e eu gostava de tentar perceber como é que funciona aquela notícia que saiu sobre o empréstimo, empréstimo comercial que já existe mas que não ficou esclarecido.",0.1724137931034483,2.45155122066717,0.012895610174172414,"Pronto, e, um, Olá, e eu gostava de, de, de tentar é, é perceber como é que funciona aquela notícia que saiu sobre o empréstimo, empréstimo comercial que, que já existe, mas que não ficou esclarecido.",0.3793103448275862,2.9794650613330305,0.009216877794289714,15783.193359375,False
pt-PT~ABROAD/CA2234890bf7ee11ae3eebdfa789f370a0_1.wav,E tu na América posso pagar as coisas quando eu estou lá,e tu na américa posso pagar as coisas quando eu estou lá,"E tu na América, posso pagar as contas quando eu lá?",0.16666666666666666,0.8065883916666886,0.005792425662855707,"E tu na América, posso pagar as contas quando eu lá?",0.16666666666666666,0.7965265586663008,0.00037741217472612217,15783.193359375,False
pt-PT~CARD_ISSUES/CA41dec2344c43f4f97dd08aaf810a515a_0.wav,Olá bom dia O meu telefone o meu cartão de Multibanco não está a funcionar não consigo fazer os pagamentos,olá bom dia o meu telefone o meu cartão de multibanco não está a funcionar não consigo fazer os pagamentos,"Hello, good day. The phone, the card of multipaybank is not working. I cannot make payments.",1.0,1.1457875253327074,0.0014999454974519493,"O meu telefon, o meu cartao de multipagamento nao esta a funcionar, nao consigo fazer os pagamentos.",0.45,1.28296257900062,0.014686738379548103,15783.193359375,False
pt-PT~BUSINESS_LOAN/response_7.wav,tenho uma pergunta sobre o empréstimo existente,tenho uma pergunta sobre o empréstimo existente,"Tenho uma pergunta sobre meu empréstimo, assistente.",0.2857142857142857,0.8061917333331318,0.010422490928627327,"Tenho uma pergunta sobre meu empréstimo, assistente.",0.2857142857142857,0.7935481289999492,0.003317786590595788,15783.193359375,False
pt-PT~APP_ERROR/response_11.wav,aplicativo não carrega saldo da minha conta,aplicativo não carrega saldo da minha conta,O aplicativo não carrega o saldo da minha conta.,0.2857142857142857,0.7048353026657423,0.002691056432813573,O aplicativo não carrega o saldo da minha conta.,0.2857142857142857,0.702685732666699,0.0007025073968906449,15783.193359375,False
pt-PT~BALANCE/CA796844d2d8dd499d50128a613fb29e9e_0.wav,Viva Bom dia estou a ligar porquê Gostaria de saber qual é que é o saldo que tenho na minha conta bancária Se me pudesse ajudar com isso agradecia obrigada,viva bom dia estou a ligar porquê gostaria de saber qual é que é o saldo que tenho na minha conta bancária se me pudesse ajudar com isso agradecia obrigada,"Viva, bonjour. Je suis en train de ringer pour que je goute de savoir quel est le solde que j'ai dans ma compte bancaire. Si me pouvait vous donner avec ce, je vous remercie. Merci.",1.0666666666666667,2.5940360390007604,0.017253125685701587,"Viva, bom dia. Eu estou ligando porque gostaria de saber qual é que é o saldo que eu tenho na minha conta bancária. Se me pudesse ajudar com isso, agradeço. Obrigado.",0.23333333333333334,2.3577309343333277,0.0012085018735280499,15783.193359375,False
pt-PT~ATM_LIMIT/response_31.wav,Boa tarde eu estou a ligar perceber Qual é a possibilidade de quanto dinheiro posso tirar da caixa eletrónico,boa tarde eu estou a ligar perceber qual é a possibilidade de quanto dinheiro posso tirar da caixa eletrónico,Good afternoon. I'm here to ask about the possibility and how much money I can withdraw from the electronic box.,1.0526315789473684,1.1680869843330584,0.003939124509042021,"Boa tarde, eu estou ligado a perceber qual é a possibilidade e quanto o dinheiro eu posso tirar da caixa eletrónica.",0.3157894736842105,1.579114594333684,0.001727165325974756,15783.193359375,False
pt-PT~CASH_DEPOSIT/response_23.wav,posso depositar dinheiro como faço para transferir dinheiro para a conta Onde posso depositar dinheiro,posso depositar dinheiro como faço para transferir dinheiro para a conta onde posso depositar dinheiro,Pode depositar dinheiro como faço pois transferir dinheiro para a conta onde posso depositar dinheiro.,0.13333333333333333,1.1032532796665084,0.0009423654551829632,Pode depositar dinheiro como faço pois transferir dinheiro para a conta onde posso depositar dinheiro,0.13333333333333333,1.0743493986671335,0.01348182962787144,15783.193359375,False
pt-PT~ABROAD/CA5247dc22c0da4b8dd34d6310a6bdb221_4.wav,precisava de fazer se o meu cartão funciona no estrangeiro eu preciso de saber se posso ir lá fala,precisava de fazer se o meu cartão funciona no estrangeiro eu preciso de saber se posso ir lá fala,I needed to know if my card works abroad. I'm going to travel and I need to know if I can use it outside.,1.263157894736842,1.3292573873332003,0.010720855621640107,Eu preciso saber se o meu cartão funciona no estrangeiro. Vou viajar e preciso saber se posso usar lá fora também.,0.5263157894736842,1.497427664332766,0.0004041556837298078,15783.193359375,False
pt-PT~ADDRESS/response_13.wav,Eu quero mudar meu endereço,eu quero mudar meu endereço,我想要搬家,1.0,0.2760591193327855,0.0014852358659002939,我想要搬家地址,1.0,0.3267399673338029,0.006425902761662834,15783.193359375,False
pt-PT~DIRECT_DEBIT/response_22.wav,Bom dia Estão aqui os outros nossos débitos diretos que estão a tirar do meu cartão se podiamos for ser sobre este assunto obrigada,bom dia estão aqui os outros nossos débitos diretos que estão a tirar do meu cartão se podiamos for ser sobre este assunto obrigada,"Hello, good day. I have a question here about your direct debits that are being taken from my card. I don't know if you could help us out with this matter. Thank you.",1.375,1.89624557233401,0.014265291329097912,"Olá, bom dia. Eu tenho uma outra questão aqui sobre os seus débitos diretos que estão a tirar do meu cartão. Se puderem esclarecer sobre este assunto, muito obrigado.",0.5833333333333334,2.1897451566668074,0.0038006566766195715,15783.193359375,False
pt-PT~CARD_ISSUES/CAea1be0a185da8a3af269fc3a0f227a89_0.wav,Eu tenho um cartão do banco cartão não funciona e recusa pagamento pode nos dar no meu cartão do meu pagamento Recusado,eu tenho um cartão do banco cartão não funciona e recusa pagamento pode nos dar no meu cartão do meu pagamento recusado,"Tem um cartão do banco, o cartão não funciona e recusa pagamento. Você pode me ajudar no meu cartão? O meu pagamento foi recusado?",0.36363636363636365,1.68627280033373,0.005287442798369198,"Tem um cartão do banco, o cartão não funciona e recusa pagamento. Você pode me ajudar no meu cartão? O meu pagamento foi recusado?",0.36363636363636365,1.6710364056665032,0.0032318427415221032,15783.193359375,False
