sample_id,reference_raw,reference_norm,hypothesis_A_original,wer_A_original,latency_mean_A_original,latency_std_A_original,hypothesis_B_pt_pinned,wer_B_pt_pinned,latency_mean_B_pt_pinned,latency_std_B_pt_pinned,peak_vram_mb,quantized
pt-PT~BALANCE/response_30.wav,Boa tarde Gostaria de ver como é que a minha conta está E está tudo em ordem assim poderiam Por favor mostrar o meu saldo para ter noção,boa tarde gostaria de ver como é que a minha conta está e está tudo em ordem assim poderiam por favor mostrar o meu saldo para ter noção,Gostaria de ver como é que a minha conta está e se está tudo em ordem assim poderia-me por favor mostrar o meu saldo para ter noção,0.14285714285714285,1.6073236653331453,0.00025043638857670725,"Boa tarde, gostaria de ver como é que a minha conta está e se está tudo em ordem assim, poderia-me por favor mostrar o meu saldo para ter noção.",0.07142857142857142,1.831445619333408,0.008036295794406356,6010.40869140625,False
pt-PT~HIGH_VALUE_PAYMENT/response_26.wav,estou a tentar fazer um pagamento de uma quantia muito elevada mas estou a receber um Código de sms Eu não sei o que é que isso significa que poderia fazer,estou a tentar fazer um pagamento de uma quantia muito elevada mas estou a receber um código de sms eu não sei o que é que isso significa que poderia fazer,"Estou a tentar fazer um pagamento de uma contiua muito elevada, mas estou a receber um código de sms. Eu não sei o que é que isso significa. O que eu poderia fazer?",0.0967741935483871,2.08375717033338,0.003731168377654923,"Estou a tentar fazer um pagamento de uma contagem muito elevada, mas estou a receber um código de sms. Eu não sei o que é que isso significa. O que eu poderia fazer?",0.0967741935483871,2.058880826000101,0.0028593782785848666,6010.40869140625,False
pt-PT~LATEST_TRANSACTIONS/CAfb042da2a2360dc624e354ac823cfaae_1.wav,eu gostaria de ver as minhas últimas transações por favor porque há um pagamento que eu não reconheço Estou sim,eu gostaria de ver as minhas últimas transações por favor porque há um pagamento que eu não reconheço estou sim,"Ela está muito bem. Eu gostaria de ver as minhas últimas transações, por favor, porque há um pagamento que eu não reconheço.",0.3,1.615357255000011,0.002720254158563755,"Ela está muito bem. Eu gostaria de ver as minhas últimas transações, por favor, porque há um pagamento que eu não reconheço.",0.3,1.621675639666743,0.004939269037697474,6010.40869140625,False
pt-PT~BALANCE/response_2.wav,Queria saber o saldo da minha conta,queria saber o saldo da minha conta,你想要知道我的余额吗？,1.0,0.46773365900010805,0.0030171755478728686,"Cuidado, eu não sei se vocês já viram o vídeo do homem que foi encontrado na água.",2.2857142857142856,1.1701386013331405,0.011381730565774618,6010.40869140625,False
pt-PT~HIGH_VALUE_PAYMENT/response_31.wav,Boa tarde eu estou a fazer um pagamento online é normal receber uma mensagem de confirmação por SMS,boa tarde eu estou a fazer um pagamento online é normal receber uma mensagem de confirmação por sms,"Good day, I'm doing a online payment. Is it normal to receive a confirmation message by SMS?",0.8333333333333334,1.076114874333295,0.0030854064781051494,"Boa tarde, eu estou a fazer um pagamento online. É normal receber uma mensagem de confirmação por SMS?",0.0,1.2492360896667378,0.003920263871722012,6010.40869140625,False
pt-PT~BUSINESS_LOAN/response_2.wav,Boa tarde estou a ligar porque tenho uma questão sobre o empréstimo comercial e gostaria de saber como é que eu faço,boa tarde estou a ligar porque tenho uma questão sobre o empréstimo comercial e gostaria de saber como é que eu faço,Good afternoon. I'm calling because I have a question about the commercial loss and I would like to know how it is that I can do it.,1.1818181818181819,1.4941548406667,0.028973202219441798,"Boa tarde, estou a ligar porque tenho uma questao sobre o emprego comercial e gostaria de saber como é que o faço.",0.13636363636363635,1.557675202666663,0.005811864403658121,6010.40869140625,False
pt-PT~BUSINESS_LOAN/response_38.wav,Boa tarde estou a ligar por causa do empréstimo comercial neste momento para aquilo mas gostava,boa tarde estou a ligar por causa do empréstimo comercial neste momento para aquilo mas gostava,"Guten Tag, ich bin hier, weil ich von einem Empfangscommerz, der uns im Moment aktiv ist, gewusst habe, dass wir eine Transfusionsversorgung haben, was wir sehr wichtig finden.",1.75,2.3084411220000525,0.01187438207896395,"Boa tarde, estou ligado porque tenho um empréstimo comercial que este momento é activo mas gostava de ter a informação sobre o mesmo, se a possibilidade.",1.1875,1.8758474530000058,0.019727996295089263,6010.40869140625,False
pt-PT~APP_ERROR/response_21.wav,Bom dia aplicação não está a carregar aplicação não está a carregar e o saldo da minha conta,bom dia aplicação não está a carregar aplicação não está a carregar e o saldo da minha conta,"Um dia a aplicação não está a carregar. A aplicação não está a carregar o saldo da minha conta. Disse que a aplicação está a ser atendida, mas não consigo aceder à minha conta.",1.0555555555555556,2.3384852490000108,0.029441819013332093,"Boa tarde. A aplicação não está a carregar. A aplicação não está a carregar o saldo da minha conta. Diz que a aplicação está a ser atendida, mas não consigo aceder à minha conta.",1.1111111111111112,2.4021136229998774,0.00465763743911195,6010.40869140625,False
pt-PT~JOINT_ACCOUNT/CA59133d901569478cf468c034e0ea7aec_0.wav,eu gostaria de ter de ter uma conta conjunta Como posso fazer obrigado,eu gostaria de ter de ter uma conta conjunta como posso fazer obrigado,"Eu gostaria de ter uma conta conjunta, como posso fazer? Obrigado.",0.15384615384615385,0.9926809933332758,0.005554098412427769,Eu gostaria de ter uma conta conjunta como posso fazer obrigado,0.15384615384615385,0.8249889786666245,0.006218664997402522,6010.40869140625,False
pt-PT~ADDRESS/response_33.wav,Bom dia eu gostaria de alterar o endereço da minha conta obrigado,bom dia eu gostaria de alterar o endereço da minha conta obrigado,Buen día. Yo gustaría de alterar el dirección de mi cuenta. Gracias.,0.8333333333333334,0.9920293553332158,0.006453508429751888,"Bom dia, eu gostaria de alterar o endereço da minha conta. Obrigado.",0.0,1.0770625113332244,0.004318554689221403,6010.40869140625,False
pt-PT~CASH_DEPOSIT/CA205f99ff45a3b0ed47731ab5e7907a1d_0.wav,Eu gostava de te deitar dinheiro na minha conta como é que eu faço E onde é que eu faço para isso acontecer,eu gostava de te deitar dinheiro na minha conta como é que eu faço e onde é que eu faço para isso acontecer,"Eu gostava de depositar dinheiro na minha conta, como é que eu faço e onde é que eu faço para isso acontecer?",0.08695652173913043,1.4284288320000087,0.004081969963971551,"Eu gostava de utilizar dinheiro na minha conta, como é que eu faço e onde é que eu faço para isso acontecer.",0.08695652173913043,1.3951142769998721,0.01817161755692392,6010.40869140625,False
pt-PT~ATM_LIMIT/CA283a3a28bfa0f116d466682dda506326_0.wav,Eu gostava de saber quanto dinheiro posso retirar da minha conta se faz favor,eu gostava de saber quanto dinheiro posso retirar da minha conta se faz favor,我想要知道多少钱可以取出来。,1.0,0.5102826263331129,0.0026887047507420103,"Ah eu gostava de saber, ah, quanto o dinheiro posso retirar da minha conta. Seu favor.",0.35714285714285715,1.2293351653333957,0.001544803488268305,6010.40869140625,False
pt-PT~CARD_ISSUES/CA9abb6beb053d5e694ed3d7f74cb249a0_0.wav,Eu tenho um cartão no seu banco e este cartão não está a funcionar Então Gostaria de saber como é que eu faço para o cartão Sinar E porque é que eu não posso usar,eu tenho um cartão no seu banco e este cartão não está a funcionar então gostaria de saber como é que eu faço para o cartão sinar e porque é que eu não posso usar,"Ah, I have a card in your bank and this card is not working. So I would like to know how I can make the card work and why I cannot use it.",1.0,1.7558717963333947,0.009890462464912915,Eu tenho um cartão no seu banco e este cartão não está a funcionar. Então eu gostaria de saber como é que eu faço para o cartão funcionar e porque é que eu não posso usar?,0.05714285714285714,2.2230026036666763,0.0022564784974782445,6010.40869140625,False
pt-PT~JOINT_ACCOUNT/response_12.wav,Como faço para poder ter uma conta a dois,como faço para poder ter uma conta a dois,我怕我怕我怕我怕我怕我怕我怕我怕我怕我怕我怕我怕我怕我怕我怕我怕我怕我怕我怕我怕我怕我怕我怕我怕我怕我怕我怕我怕我怕我怕我怕我怕我怕我怕我怕我怕我怕我怕我怕我怕我怕我怕我怕我怕我怕我怕我怕我怕我怕我怕我怕我怕我怕我怕我怕我怕我怕我怕我怕我怕我怕我怕我怕我怕我怕我怕我怕我怕我怕我怕我怕我怕我怕我怕我怕我怕我怕我怕我怕我怕我怕我怕我怕我怕我怕我怕我怕我怕我怕我怕我怕我怕我怕我怕我怕我怕我怕我怕我怕我怕我怕我怕我怕我怕我怕我怕我怕我怕我怕我怕我怕我怕我怕我怕我怕我怕我怕我怕我怕我怕我怕我怕我怕我怕我怕我怕我怕我怕,1.0,11.447388446333207,0.031557994046748764,怎么发错，我得有那个账号。,1.0,0.5750492663332807,0.006856652395241372,6010.40869140625,False
pt-PT~BUSINESS_LOAN/response_29.wav,estou ligando mas falando sobre um empréstimo comichão tenham perguntas sobre empréstimo existente ou novo empréstimo,estou ligando mas falando sobre um empréstimo comichão tenham perguntas sobre empréstimo existente ou novo empréstimo,Estou ligando para se ligando sobre um empréstimo comercial. Tenho uma pergunta sobre empréstimo existente ou novo empréstimo?,0.4375,1.6980485016667142,0.0038028595052240406,Estou ligando para se ligando sobre um empréstimo comercial. Tenho uma pergunta sobre empréstimo existente ou novo empréstimo?,0.4375,1.6955241780001415,0.00456129613868819,6010.40869140625,False
pt-PT~ATM_LIMIT/response_30.wav,Qual é o livro que pode tirar,qual é o livro que pode tirar,Good day. Could you please tell me what is the limit of money that I can withdraw from the book bank?,3.0,1.153885550333295,0.0028267520994432393,"Um dia, eu acho que sabe dizer qual é o limite de dinheiro que eu posso tirar no bookbank.",2.0,1.2873456116669029,0.003201018538523119,6010.40869140625,False
pt-PT~BUSINESS_LOAN/CAb76c47b24dcd98ec8e4f3252d2c3a332_0.wav,Eu estou a ligar porque preciso saber algo Fica bem informações sobre o novo empréstimo faz favor,eu estou a ligar porque preciso saber algo fica bem informações sobre o novo empréstimo faz favor,"I'm just calling because I need to know something -- I need to know information about the new loan, may I please?",1.2352941176470589,1.2468446596665974,0.005942493257874705,"Eu estou ligar porque preciso de saber algo, preciso de saber informações sobre o novo empréstimo, mas a favor?",0.4117647058823529,1.4190103146664417,0.005504212436011849,6010.40869140625,False
pt-PT~ATM_LIMIT/response_34.wav,Boa tarde Qual é o valor máximo que posso levantar da caixa,boa tarde qual é o valor máximo que posso levantar da caixa,保持干燥。,1.0,0.28944089166679987,0.008483943035658678,保持干燥。,1.0,0.278340142666669,0.004576915018846283,6010.40869140625,False
pt-PT~CARD_ISSUES/CAd2a5b1d83fc0c3be65abd3390af3b05b_0.wav,Bom dia Porque é que o meu pagamento foi recusado,bom dia porque é que o meu pagamento foi recusado,"Bom dia, por que o meu pagamento foi recusado?",0.2,0.7605535469998964,0.005546632670869627,"Bom dia, por que o meu pagamento foi recusado?",0.2,0.7822861840001375,0.01165088817054338,6010.40869140625,False
pt-PT~DIRECT_DEBIT/response_31.wav,tinha algumas questões sobre débitos diretos nomeadamente Como é que eu posso ver os meus débitos diretos se eu quiser vou ver algum Como é que eu posso proceder queria mais informações acerca disso por favor,tinha algumas questões sobre débitos diretos nomeadamente como é que eu posso ver os meus débitos diretos se eu quiser vou ver algum como é que eu posso proceder queria mais informações acerca disso por favor,"Tem alguma questoes sobre debitos diretos, nomeadamente como e que eu possa ver os meus debitos diretos se eu quiser devolver algum como e que eu possa proceder. Cria mais informacoes acerca disso, por favor.",0.3611111111111111,2.627200549666668,0.024984781717922937,"Tinha alguma questoes sobre debitos diretos, nomeadamente como e que eu possa ver os meus debitos diretos se eu quiser devolver algum como e que eu possa proceder. Cria mais informacoes acerca disso, por favor.",0.3333333333333333,2.634114405000067,0.014139435127920286,6010.40869140625,False
pt-PT~ATM_LIMIT/response_6.wav,posso aumentar o limite para retirar,posso aumentar o limite para retirar,Pode aumentar o limite para retirar?,0.16666666666666666,0.5849205443334237,0.003179641705888975,Pode aumentar o limite para retirar.,0.16666666666666666,0.5933155946668194,0.014744571939975245,6010.40869140625,False
pt-PT~APP_ERROR/CA819dbf8cf04171e2394a0952a5e1fcc7_0.wav,estou a ter problemas com a minha conta bancária do telemóvel neste momento não consigo ver o saldo da conta,estou a ter problemas com a minha conta bancária do telemóvel neste momento não consigo ver o saldo da conta,"Estou a ter problemas com a minha conta bancária do telefónica. Neste momento, não consigo ver o saldo da conta. Pode imaginar um problema do aplicativo?",0.35,1.8751550053333024,0.007845162157267797,"Estou a ter problemas com a minha conta bancária do telefónica. Neste momento, não consigo ver o saldo da conta. Pode imaginar um problema do aplicativo.",0.35,1.875409353333301,0.009741109932596184,6010.40869140625,False
pt-PT~ATM_LIMIT/CA04d2aca944e40228f5a47860d41a500f_0.wav,Bom dia Estou a tentar levantar dinheiro da caixa multibanco e gosto de ti do qual era a quantidade máxima permitida para levantamento,bom dia estou a tentar levantar dinheiro da caixa multibanco e gosto de ti do qual era a quantidade máxima permitida para levantamento,"Bom dia, eu sou tentando levantar dinheiro da caixa do banco e gostaria de saber qual é a quantidade máxima permitida para o levantamento.",0.43478260869565216,1.6395522890002212,0.011051553864927911,"Bom dia, eu sou tentar alvaritar dinheiro da caixa multibanco e gostaria de saber qual é a quantidade máxima permitida para o alvaritar.",0.391304347826087,1.7329525773334353,0.01170739838570856,6010.40869140625,False
pt-PT~PAY_BILL/response_17.wav,Bom dia tentei apagar uma conta pela Via web mas não foi possível Então Gostaria de pagar por chamada é possível,bom dia tentei apagar uma conta pela via web mas não foi possível então gostaria de pagar por chamada é possível,"Tentou antes pagar uma conta via web, mas não foi possível. Eu gostaria de pagar por chamado, é possível?",0.3333333333333333,1.322890665666667,0.004784257939402647,"Um dia eu tentei pagar uma conta via web, mas não foi possível. Eu gostaria de pagar por chamado, é possível?",0.2857142857142857,1.423830753666607,0.008112667685502112,6010.40869140625,False
pt-PT~ATM_LIMIT/response_4.wav,Olá bom dia eu gostava de tirar dinheiro da minha conta bancária e gostava de saber qual é o limite e quanto é que quando dinheiro é que eu posso tirar,olá bom dia eu gostava de tirar dinheiro da minha conta bancária e gostava de saber qual é o limite e quanto é que quando dinheiro é que eu posso tirar,"Hello, good day. I would like to withdraw money from my bank account and I would like to know what is the limit and how much money can I withdraw.",1.0,1.5911770103333158,0.008915826333776728,"Qual a boa, eu gostava de tirar dinheiro da minha conta bancária e gostava de saber qual é o limite e quanto é que dinheiro é que eu posso tirar.",0.12903225806451613,1.8011055109999081,0.005080425718833846,6010.40869140625,False
pt-PT~JOINT_ACCOUNT/response_27.wav,Olá bom dia Sim eu gostava de ter configurar uma conta conjunta nossa mãe não sabem como estava a fazer isso com o meu pai e com a minha parceira no aplicativo não estava a encontrar aonde é que posso ok ok ok ok Obrigado sim ok,olá bom dia sim eu gostava de ter configurar uma conta conjunta nossa mãe não sabem como estava a fazer isso com o meu pai e com a minha parceira no aplicativo não estava a encontrar aonde é que posso ok ok ok ok obrigado sim ok,"Hello, good day. Yes, I was going to configure a joint account. I don't know how to do it and I wanted to do this with my partner. In the application, I didn't know how to find the option where I can. Ah, okay, here, okay, okay, thank you. Yes, okay.",1.0851063829787233,3.1474932383331784,0.01963029467382096,"Hala, bom dia. Sim, eu gostava de te configurar uma conta conjunta. Eu não sei bem, percebi bem como e gostava de fazer isso com, com meu parceiro, com minha parceira. No app, no aplicativo, não estava a encontrar a opção de que posso. Ah, okay aqui. Okay, okay, obrigado. Sim, okay.",0.5531914893617021,3.7959191343335683,0.00455313813675225,6010.40869140625,False
pt-PT~CARD_ISSUES/response_19.wav,Boa tarde eu gostaria de saber porque é que o meu pagamento foi recusado,boa tarde eu gostaria de saber porque é que o meu pagamento foi recusado,"Bom tarde, eu gostaria de saber porque o meu pagamento foi recusado.",0.21428571428571427,0.9418924986666752,0.0016720464170495966,"Bom tarde, eu gostaria de saber porque o meu pagamento foi recusado.",0.21428571428571427,0.941745756666478,0.011647872669550847,6010.40869140625,False
pt-PT~ABROAD/CAf725e67d481bd4a064e829adae4b3e74_2.wav,Eu gostava de saber se o meu cartão poderá ser utilizado no exterior,eu gostava de saber se o meu cartão poderá ser utilizado no exterior,我想要知道我的卡是否可以使用在国际上。,1.0,0.6886157303330643,0.007495318627640079,Ah eu gosto de saber se o meu cartão poderá ser utilizado no exterior.,0.15384615384615385,0.9439996696666336,0.009930258305925949,6010.40869140625,False
pt-PT~ATM_LIMIT/response_19.wav,Boa tarde gostaria de fazer uma transferência e gostava de saber qual é que é o limite máximo,boa tarde gostaria de fazer uma transferência e gostava de saber qual é que é o limite máximo,"Um boa tarde, eu gostaria de fazer uma transferência e eu preciso saber qual é o limite máximo. É possível alterar o limite máximo? Ah, obrigado.",0.6111111111111112,1.736929061000107,0.0016743270328748259,"Boa tarde, eu gostaria de fazer uma transferência e eu preciso saber qual é o limite máximo. É possível alterar o limite máximo? Ah, obrigado.",0.5555555555555556,1.7362747373332847,0.003974328233488841,6010.40869140625,False
pt-PT~APP_ERROR/response_35.wav,o aplicativo não carrega o saldo da minha conta diz que diz que a tia estaciona Atende e agora não consigo acessar a minha conta,o aplicativo não carrega o saldo da minha conta diz que diz que a tia estaciona atende e agora não consigo acessar a minha conta,"O aplicativo não cria o salvo na minha conta, diz que o aplicativo está sendo atendido e agora eu não consigo acessar a minha conta.",0.4,1.6833971436667525,0.02167612242427193,"O aplicativo não cria o salvo na minha conta, diz que o aplicativo está sendo atendido e agora eu não consigo acessar a minha conta.",0.4,1.6632032020002043,0.011039212321953732,6010.40869140625,False
pt-PT~ATM_LIMIT/response_1.wav,Qual é o máximo de dinheiro que eu posso tirar da minha conta uma caixa,qual é o máximo de dinheiro que eu posso tirar da minha conta uma caixa,Qual é o máximo do dinheiro que eu posso tirar da minha conta de uma caixa?,0.13333333333333333,1.05976287566682,0.014186681601849884,Qual é o máximo do dinheiro que eu posso tirar da minha conta de uma caixa,0.13333333333333333,0.9933786589999727,0.010304476985084868,6010.40869140625,False
pt-PT~BALANCE/response_8.wav,bom dia eu queria saber qual é que era o saldo da minha conta o que tenho agora seria possível mostrar-me Qual é que é o saldo que tenho obrigada,bom dia eu queria saber qual é que era o saldo da minha conta o que tenho agora seria possível mostrarme qual é que é o saldo que tenho obrigada,"Ah bonjour, eu-je souhaiter savoir quel est le solde de ma compte ou le que j'ai maintenant. Ah, serait possible de me montrer quel est le solde que j'ai? Merci.",0.9666666666666667,2.180946997666524,0.0019235346787197546,"Ah bonjour, je voudrais savoir quel est le solde de ma compte ou le que j'ai maintenant. Ah, serait possible de me montrer quel est le solde que j'ai? Merci.",0.9666666666666667,2.1166740549999,0.012570354105768532,6010.40869140625,False
pt-PT~ATM_LIMIT/CAf993dfd97839777adb6e202245b9ba20_0.wav,como sobre débitos diretos Queria ver uma débito direto e queria vou ver o meu débito direto,como sobre débitos diretos queria ver uma débito direto e queria vou ver o meu débito direto,Fala-me sobre débitos diretos. Queria ver o meu débito direto e quero ver o meu débito direto. Número nove nove zero.,0.5294117647058824,1.9244274790000115,0.005518626966080575,"Fala-me sobre débitos diretos. Queria ver o meu débito direto e quero ver o meu débito direto. Número nove, nove, zero.",0.5294117647058824,1.9932759196666059,0.009821861401409669,6010.40869140625,False
pt-PT~ATM_LIMIT/response_18.wav,quanto dinheiro posso tirar no caixa eletrónico,quanto dinheiro posso tirar no caixa eletrónico,Quant'oro denaro posso ritirare nel caufio elettronico?,0.8571428571428571,0.9883801913335143,0.006998407712282338,Quant dinheiro posso retirar no caixa eletrônico,0.42857142857142855,0.7161953936667184,0.00423490133461454,6010.40869140625,False
pt-PT~ATM_LIMIT/CAf0be9898d46c7739163733f22e6978e7_0.wav,eu queria saber qual é que é Olá eu queria saber qual é que é a quantidade máxima de dinheiro que eu posso levantar eletronicamente da minha da minha conta,eu queria saber qual é que é olá eu queria saber qual é que é a quantidade máxima de dinheiro que eu posso levantar eletronicamente da minha da minha conta,I would like to know what is the quantity of money that I can withdraw electronically from my account?,1.0,1.0354554003332244,0.005903382263047106,"Eu quero saber qual é a quantidade máxima de dinheiro que eu posso levar, eletronicamente, da minha conta?",0.4666666666666667,1.385601255333313,0.0339729523202918,6010.40869140625,False
pt-PT~CARD_ISSUES/response_38.wav,Bom dia estou a ter um problema com o meu cartão acha que me pode ajudar eu não sei porquê mas o meu cartão não está a dar para usar ele está a funcionar e por isso mesmo meu pagamento foi recusado,bom dia estou a ter um problema com o meu cartão acha que me pode ajudar eu não sei porquê mas o meu cartão não está a dar para usar ele está a funcionar e por isso mesmo meu pagamento foi recusado,"Bom dia, sou um problema com o meu cartão, acho que me pode ajudar, eu não sei porquê, mas o meu cartão não está para usar, ele não está a funcionar e por isso mesmo o pagamento foi recusado.",0.19047619047619047,2.5875018390000455,0.017173851918770702,"Bom dia, sou um problema com o meu cartão. Acho que me pode ajudar. Eu não sei por que, mas o meu cartão não está para usar. Ele não está a funcionar e por isso mesmo, o pagamento foi recusado.",0.23809523809523808,2.5756126606667444,0.012407689777666204,6010.40869140625,False
pt-PT~FREEZE/response_24.wav,Olá bom dia eu gostaria de congelar o meu cartão interromper as transações do mesmo é possível por favor bloqueie Então meu cartão obrigada,olá bom dia eu gostaria de congelar o meu cartão interromper as transações do mesmo é possível por favor bloqueie então meu cartão obrigada,"Ala, bon dia. Eu gostaria de cancelar congelar o meu cartão, interromper as transações do mês. É possível, por favor, bloqueiem então o meu cartão, obrigada.",0.25,2.2146862463334096,0.00836876758691337,"Falando, bom dia. Eu gostaria de cancelar congelar o meu cartão, interromper as transações do mês. É possível, por favor, bloqueiem então o meu cartão, obrigada.",0.20833333333333334,2.2227296976666366,0.008832533133957338,6010.40869140625,False
pt-PT~BUSINESS_LOAN/response_18.wav,desligar tu gostaria de saber mais sobre comercial e por isso tenho uma pergunta a fazer sobre o novo empréstimo,desligar tu gostaria de saber mais sobre comercial e por isso tenho uma pergunta a fazer sobre o novo empréstimo,Só ligar porque quero saber mais sobre um empréstimo comercial e por isso tenho uma pergunta a fazer sobre o novo empréstimo.,0.3,1.6495293250000032,0.0022399429347685594,Só ligar porque quero saber mais sobre um empréstimo comercial e por isso tenho uma pergunta a fazer sobre o novo empréstimo.,0.3,1.6583481873332555,0.01229895919095091,6010.40869140625,False
pt-PT~ADDRESS/CAd6fdfb123335cacb9a702258a3344162_0.wav,quero mudar a minha morada de um serviço qualquer coletividade televisão Mudei de casa que mudar morada,quero mudar a minha morada de um serviço qualquer coletividade televisão mudei de casa que mudar morada,"Ah, quer mudar a minha morada de um serviço qualquer, telecidad, televisão, mudei de casa, quer mudar a morada.",0.29411764705882354,1.625831350666734,0.0021496199911282166,"Quer mudar a minha morada de um serviço qualquer, telefonia, televisão, mudei de casa, quer mudar a morada.",0.23529411764705882,1.6140969396666758,0.00736080567938105,6010.40869140625,False
pt-PT~APP_ERROR/response_19.wav,o aplicativo não carrega,o aplicativo não carrega,O aplicativo não carrega.,0.0,0.4660648186666852,0.008052356326744307,O aplicativo não carrega.,0.0,0.45342913966669585,0.0038619118101594573,6010.40869140625,False
